,Unnamed: 0,date,year,month,day,time,hour,minute,latitude,longitude,material_at_origin,land_use_at_origin,size,suppressed_by,suppressing_agency,facility_identification,other_companies,voltage_volts_,equipment_involved_with_ignition,type,was_there_an_outage,date_1,time_1,suspected_initiating_event,equipment_facility_failure,contact_from_object,facility_contacted,contributing_factor,unnamed_23,material_at_origin_comments,voltage,datetime,wind_speed,wind_speed_max
0,0,6/10/2014,2014,6,10,12:15:14 AM,0,15,40.20599,-122.25333,Vegetation,Rural,< 0.25 Acres,Fire Agency,Red Bluff FD,101545144,,12000,Conductor,Overhead,Yes,6/10/2014 15:14,6/10/2014 15:14,Contact From Object,N.A.,Other,Electric Facility,Human Error,Conveyor belt contact,,,2014-06-10 00:15:00,14.8,18.4
1,1,6/12/2014,2014,6,12,12:06:30 AM,0,6,38.04374999,-122.74623999999999,Vegetation,Rural,10 - 99 Acres,Fire Agency,Cal Fire et al,102230371,AT&T,12000,Conductor,Overhead,Yes,6/12/2014 6:30,6/12/2014 6:30,Equipment/ Facility Failure,Crossarm,N.A.,N.A.,Unknown,,,,2014-06-12 00:06:00,no data,18.4
2,2,6/13/2014,2014,6,13,12:09:19 AM,0,9,36.93347999,-121.388549,Vegetation,Rural,< 0.25 Acres,Fire Agency,Hollister FD,101703071,AT&T,21000,Conductor,Overhead,Yes,6/13/2014 9:19,6/13/2014 9:19,Contact From Object,N.A.,Vehicle,Pole,Human Error,,,,2014-06-13 00:09:00,35.3,37.1
3,3,6/14/2014,2014,6,14,12:08:47 AM,0,8,37.419005,-122.18077,Vegetation,Rural,< 3 meters ,Unknown,,100275552,AT&T,12000,Conductor,Overhead,Yes,6/14/2014 8:47,6/14/2014 8:47,Contact From Object,N.A.,Animal,Electric Facility,Unknown,,,,2014-06-14 00:08:00,31.7,31.7
4,4,6/14/2014,2014,6,14,12:11:01 AM,0,11,37.130915,-121.09191799999999,Vegetation,Rural,10 - 99 Acres,Fire Agency,CAL Fire,Pole 000/013,None,70000,Conductor,Overhead,Yes,6/14/2014 11:01,6/14/2014 11:01,Equipment/ Facility Failure,Crossarm,N.A.,N.A.,Unknown,,,,2014-06-14 00:11:00,29.5,31.7
5,5,6/15/2014,2014,6,15,12:09:47 AM,0,9,37.130774,-121.97141,Vegetation,Rural,< 0.25 Acres,Fire Agency,,"23633 Schulties Rd, Los Gatos",,12000,Conductor,Overhead,Yes,6/15/2014 9:47,6/15/2014 9:47,Contact From Object,N.A.,Vegetation,Electric Facility,Unknown,,,,2014-06-15 00:09:00,25.9,27.7
6,6,6/15/2014,2014,6,15,12:17:28 AM,0,17,37.970771,-121.984981,Vegetation,Urban,< 3 meters ,Self Extinguished,,"4239 Teakwood Ct, Concord",,0 – 750,Conductor,Overhead,Yes,6/15/2014 17:28,6/15/2014 17:28,Wire-Wire Contact,N.A.,N.A.,N.A.,Weather,,,,2014-06-15 00:17:00,31.7,35.3
7,7,6/15/2014,2014,6,15,12:20:55 AM,0,20,39.88785999,-122.197369,Vegetation,Rural,< 0.25 Acres,Fire Agency,Cal Fire,101500605,,12000,Conductor,Overhead,Yes,6/15/2014 20:55,6/15/2014 20:55,Contact From Object,N.A.,Vehicle,Pole,Human Error,,,,2014-06-15 00:20:00,7.6,20.5
8,8,6/16/2014,2014,6,16,12:15:37 AM,0,15,38.16816999,-120.607469,Vegetation,Rural,< 0.25 Acres,Fire Agency,,101280871,AT&T,0 – 750,Conductor,Overhead,No, , ,Contact From Object,N.A.,Vegetation,Electric Facility,Unknown,,,,2014-06-16 00:15:00,13.0,14.8
9,9,6/17/2014,2014,6,17,12:13:49 AM,0,13,38.666794,-122.596397,Vegetation,Rural,< 3 meters ,Fire Agency,Cal Fire,102247824,  ,12000,Conductor,Overhead,Yes,6/17/2014 13:49,6/17/2014 13:49,Contact From Object,N.A.,Vehicle,Pole,Human Error,,,,2014-06-17 00:13:00,14.8,20.5
10,10,6/17/2014,2014,6,17,12:14:50 AM,0,14,40.96058,-124.04395900000002,Vegetation,Rural,< 0.25 Acres,Unknown,,100979528,AT&T,0 – 750,Conductor,Overhead,Yes,6/17/2014 14:50,6/17/2014 14:50,Wire-Wire Contact,N.A.,N.A.,N.A.,Unknown,,,,2014-06-17 00:14:00,27.7,35.3
11,11,6/17/2014,2014,6,17,12:16:47 AM,0,16,34.68609,-120.432732,Vegetation,Rural,< 3 meters ,Self Extinguished,,101894765, ,12000,Conductor,Overhead,Yes,6/17/2014 16:47,6/17/2014 16:47,Equipment/ Facility Failure,Splice/Clamp/Connector,N.A.,N.A.,Unknown,,,,2014-06-17 00:16:00,31.7,31.7
12,12,6/17/2014,2014,6,17,12:21:24 AM,0,21,38.418040000000005,-121.14046100000002,Vegetation,Rural,10 - 99 Acres,Unknown,,Twr. 052/320,None,115000,Conductor,Overhead,Yes,6/17/2014 21:24,6/17/2014 21:24,Contact From Object,N.A.,Animal,Electric Facility,Unknown,,,,2014-06-17 00:21:00,16.6,21.6
13,13,6/18/2014,2014,6,18,12:10:01 AM,0,10,37.801097999999996,-121.202156,Vegetation,Urban,.26 - 9.99 Acres,Fire Agency,Manteca FD,102085311,Verizon,17000,Conductor,Overhead,Yes,6/18/2014 10:01,6/18/2014 10:01,Equipment/ Facility Failure,Splice/Clamp/Connector,N.A.,N.A.,Unknown,,,,2014-06-18 00:10:00,22.3,22.3
14,14,6/18/2014,2014,6,18,12:18:29 AM,0,18,37.317509,-120.50490500000001,Vegetation,Urban,< 0.25 Acres,Fire Agency,Cal Fire,101162090,AT&T,0 – 750,Capacitor Bank,Overhead,No, , ,Equipment/ Facility Failure,Capacitor Bank,N.A.,N.A.,Unknown,,,,2014-06-18 00:18:00,27.7,27.7
15,15,6/19/2014,2014,6,19,12:16:32 AM,0,16,37.931459999999994,-121.2999,Vegetation,Urban,< 0.25 Acres,Unknown,,102133758,AT&T,0 – 750,Conductor,Overhead,No, , ,Equipment/ Facility Failure,Other,N.A.,N.A.,Unknown,service conductor,,,2014-06-19 00:16:00,16.6,24.1
16,16,6/19/2014,2014,6,19,12:18:54 AM,0,18,38.780198999999996,-121.500724,Vegetation,Rural,.26 - 9.99 Acres,Fire Agency,,101297449,AT&T,12000,Conductor,Overhead,Yes,6/19/2014 18:54,6/19/2014 18:54,Equipment/ Facility Failure,Splice/Clamp/Connector,N.A.,N.A.,Unknown,,,,2014-06-19 00:18:00,5.4,18.4
17,17,6/20/2014,2014,6,20,12:09:47 AM,0,9,34.865099,-120.320672,Vegetation,Rural,< 0.25 Acres,Unknown,,101862409, ,12000,Conductor,Overhead,Yes,6/20/2014 9:47,6/20/2014 9:47,Equipment/ Facility Failure,Splice/Clamp/Connector,N.A.,N.A.,Unknown,,,,2014-06-20 00:09:00,24.1,24.1
18,18,6/20/2014,2014,6,20,12:12:00 AM,0,12,39.666337,-122.196881,Vegetation,Rural,< 0.25 Acres,Unknown,,100422609,,0 – 750,Capacitor Bank,Overhead,No, , ,Equipment/ Facility Failure,Capacitor Bank,N.A.,N.A.,Unknown,,,,2014-06-20 00:12:00,18.4,18.4
19,19,6/20/2014,2014,6,20,12:14:15 AM,0,14,40.78022999,-121.50287,Vegetation,Rural,< 0.25 Acres,Fire Agency,,101520035,Frontier,12000,Conductor,Overhead,Yes,6/20/2014 14:15,6/20/2014 14:15,Contact From Object,N.A.,Vegetation,Electric Facility,Unknown,,,,2014-06-20 00:14:00,20.5,22.3
20,20,6/21/2014,2014,6,21,12:06:49 AM,0,6,38.3753,-122.5494,Vegetation,Rural,< 0.25 Acres,Fire Agency,,"3111 WARM SPRINGS RD, GLEN ELLEN", ,12000,Conductor,Overhead,Yes,6/21/2014 6:49,6/21/2014 6:49,Contact From Object,N.A.,Vegetation,Electric Facility,Unknown,,,,2014-06-21 00:06:00,no data,22.3
21,21,6/21/2014,2014,6,21,12:14:36 AM,0,14,38.36443999,-122.262649,Vegetation,Rural,< 3 meters ,Fire Agency,Cal Fire,102286053,AT&T,12000,Conductor,Overhead,Yes,6/21/2014 14:36,6/21/2014 14:36,Contact From Object,N.A.,Vehicle,Pole,Human Error,,,,2014-06-21 00:14:00,33.5,33.5
22,22,6/22/2014,2014,6,22,12:08:19 AM,0,8,34.894389000000004,-120.42445900000001,Vegetation,Urban,< 3 meters ,Unknown,,101864052,Verizon,12000,Conductor,Overhead,Yes,6/22/2014 8:19,6/22/2014 8:19,Equipment/ Facility Failure,Conductor,N.A.,N.A.,Unknown,,,,2014-06-22 00:08:00,0.0,24.1
23,23,6/23/2014,2014,6,23,12:06:04 AM,0,6,37.5046,-120.00742,Vegetation,Rural,< 0.25 Acres,Unknown,,Pole 007/019,None,70000,Conductor,Overhead,Yes,6/23/2014 6:04,6/23/2014 6:04,Contact From Object,N.A.,Animal,Electric Facility,Unknown,,,,2014-06-23 00:06:00,13.0,14.8
24,24,6/23/2014,2014,6,23,12:17:45 AM,0,17,39.064023999999996,-121.02248600000001,Vegetation,Rural,.26 - 9.99 Acres,Fire Agency,,BET: MTR# 1007517420 & FUCO 7495,,12000,Conductor,Overhead,Yes,6/23/2014 17:45,6/23/2014 17:45,Contact From Object,N.A.,Vegetation,Electric Facility,Unknown,,,,2014-06-23 00:17:00,0.0,9.4
25,25,6/24/2014,2014,6,24,12:07:11 AM,0,7,36.74953999,-121.65706000000002,Vegetation,Rural,< 0.25 Acres,Fire Agency,Salinas FD,101712215,AT&T,12000,Conductor,Overhead,Yes,6/24/2014 7:11,6/24/2014 7:11,Equipment/ Facility Failure,Conductor,N.A.,N.A.,Unknown,,,,2014-06-24 00:07:00,no data,9.4
27,27,6/24/2014,2014,6,24,12:14:31 AM,0,14,39.78568,-121.90659,Vegetation,Rural,10 - 99 Acres,Fire Agency,Cal Fire,Mtr 36P580,None,12000,Conductor,Overhead,Yes,6/24/2014 14:31,6/24/2014 14:31,Contact From Object,N.A.,Animal,Electric Facility,Unknown,,,,2014-06-24 00:14:00,18.4,18.4
28,28,6/24/2014,2014,6,24,12:16:56 AM,0,16,37.974014000000004,-121.34646200000002,Vegetation,Urban,< 0.25 Acres,Unknown,,103190493, ,12000,Conductor,Overhead,Yes,6/24/2014 16:56,6/24/2014 16:56,Contact From Object,N.A.,Vegetation,Electric Facility,Unknown,,,,2014-06-24 00:16:00,18.4,18.4
29,29,6/24/2014,2014,6,24,12:17:12 AM,0,17,38.110973,-122.56451200000001,Vegetation,Urban,.26 - 9.99 Acres,Fire Agency,Novato Fire Department,102223842,,0 – 750,Conductor,Overhead,No, , ,Contact From Object,N.A.,Vegetation,Electric Facility,Unknown,,,,2014-06-24 00:17:00,no data,18.4
30,30,6/25/2014,2014,6,25,12:01:36 AM,0,1,36.89085,-121.71746,Vegetation,Rural,< 0.25 Acres,Unknown,,101697469,AT&T,0 – 750,Conductor,Overhead,No, , ,Contact From Object,N.A.,Balloons,Electric Facility,Human Error,,,,2014-06-25 00:01:00,14.8,14.8
31,31,6/25/2014,2014,6,25,12:08:51 AM,0,8,34.88304,-120.277619,Vegetation,Rural,.26 - 9.99 Acres,Fire Agency,,LD SIDE MTR 1008835806,,12000,Conductor,Overhead,Yes,6/25/2014 8:51,6/25/2014 8:51,Equipment/ Facility Failure,Conductor,N.A.,N.A.,Unknown,,,,2014-06-25 00:08:00,35.3,35.3
32,32,6/25/2014,2014,6,25,12:08:53 AM,0,8,39.01101,-120.89606,Vegetation,Rural,.26 - 9.99 Acres,Unknown,,Main Line N/O buck to 20340 Spring Garden # 1004520726,,12000,Conductor,Overhead,Yes,6/25/2014 8:53,6/25/2014 8:53,Contact From Object,N.A.,Vegetation,Electric Facility,Human Error,Third-party caused,,,2014-06-25 00:08:00,9.4,14.8
33,33,6/25/2014,2014,6,25,12:21:47 AM,0,21,37.997663,-121.769186,Vegetation,Rural,< 0.25 Acres,Unknown,,100455766,,21000,Conductor,Overhead,Yes,6/25/2014 21:47,6/25/2014 21:47,Contact From Object,N.A.,Animal,Electric Facility,Unknown,,,,2014-06-25 00:21:00,no data,14.8
34,34,6/26/2014,2014,6,26,12:00:15 AM,0,0,36.80024999,-119.793779,Vegetation,Urban,< 0.25 Acres,Fire Agency,Fresno Fire Dept,100854012,AT&T,12000,Conductor,Overhead,Yes,6/26/2014 0:15,6/26/2014 0:15,Contact From Object,N.A.,Animal,Electric Facility,Unknown,,,,2014-06-26 00:00:00,22.3,22.3
35,35,6/28/2014,2014,6,28,12:23:04 AM,0,23,37.899207000000004,-121.860878,Vegetation,Rural,< 0.25 Acres,Unknown,,100483886,,21000,Transformer,Overhead,Yes,6/28/2014 23:04,6/28/2014 23:04,Contact From Object,N.A.,Animal,Electric Facility,Unknown,,,,2014-06-28 00:23:00,no data,22.3
36,36,6/29/2014,2014,6,29,12:07:59 AM,0,7,38.7794,-121.505549,Vegetation,Rural,< 0.25 Acres,Fire Agency,,101297918,AT&T,0 – 750,Transformer,Overhead,Yes,6/29/2014 7:59,6/29/2014 7:59,Equipment/ Facility Failure,Transformer,N.A.,N.A.,Unknown,,,,2014-06-29 00:07:00,0.0,11.2
37,37,6/29/2014,2014,6,29,12:08:23 AM,0,8,39.09198,-121.54307,Vegetation,Urban,< 0.25 Acres,Unknown,,SB 15745  ARBOGA RD 500' S/O FURNEAUX RD 2 SP EAST,,12000,Conductor,Overhead,Yes,6/29/2014 8:23,6/29/2014 8:23,Equipment/ Facility Failure,Conductor,N.A.,N.A.,Unknown,,,,2014-06-29 00:08:00,9.4,14.8
38,38,6/29/2014,2014,6,29,12:19:53 AM,0,19,38.5208,-123.06067,Vegetation,Rural,< 0.25 Acres,Fire Agency,Cal Fire,3600 E. AUTSTIN CREEK RD,,12000,Conductor,Overhead,Yes,6/29/2014 19:53,6/29/2014 19:53,Contact From Object,N.A.,Vegetation,Electric Facility,Unknown,,,,2014-06-29 00:19:00,14.8,16.6
39,39,6/30/2014,2014,6,30,12:14:08 AM,0,14,38.44917999,-122.87276999999999,Vegetation,Rural,< 0.25 Acres,Unknown,,102022582,AT&T,0 – 750,Conductor,Overhead,No, , ,Contact From Object,N.A.,Vegetation,Electric Facility,Unknown,,,,2014-06-30 00:14:00,16.6,16.6
40,40,6/30/2014,2014,6,30,12:18:25 AM,0,18,39.144927,-122.131882,Vegetation,Rural,< 0.25 Acres,Unknown,,101629033,,12000,Conductor,Overhead,Yes,6/30/2014 18:25,6/30/2014 18:25,Contact From Object,N.A.,Animal,Electric Facility,Unknown,,,,2014-06-30 00:18:00,,14.8
41,41,6/30/2014,2014,6,30,12:20:02 AM,0,20,36.80801999,-119.91013899999999,Vegetation,Urban,< 0.25 Acres,Unknown,,100625545,AT&T,21000,Conductor,Overhead,Yes,6/30/2014 20:02,6/30/2014 20:02,Contact From Object,N.A.,Animal,Electric Facility,Unknown,,,,2014-06-30 00:20:00,13.0,14.8
42,42,7/1/2014,2014,7,1,12:03:46 AM,0,3,37.900473,-121.26025800000001,Vegetation,Rural,< 0.25 Acres,Unknown,,2 POLES EAST OF C3412,,12000,Conductor,Overhead,Yes,7/1/2014 3:46,7/1/2014 3:46,Contact From Object,N.A.,Vehicle,Pole,Human Error,,,,2014-07-01 00:03:00,18.4,18.4
43,43,7/1/2014,2014,7,1,12:06:43 AM,0,6,38.00623,-122.64303000000001,Vegetation,Rural,.26 - 9.99 Acres,Fire Agency,West Marin Fire,102258915,AT&T,12000,Conductor,Overhead,Yes,7/1/2014 6:43,7/1/2014 6:43,Contact From Object,N.A.,Vegetation,Electric Facility,Unknown,,,,2014-07-01 00:06:00,no data,18.4
44,44,7/1/2014,2014,7,1,12:09:45 AM,0,9,37.42669,-119.88095,Vegetation,Rural,.26 - 9.99 Acres,Unknown,,101065832,,21000,Conductor,Overhead,Yes,7/1/2014 9:45,7/1/2014 9:45,Contact From Object,N.A.,Animal,Electric Facility,Unknown,,,,2014-07-01 00:09:00,13.0,13.0
45,45,7/1/2014,2014,7,1,12:14:36 AM,0,14,38.86486999,-121.70255,Vegetation,Rural,< 0.25 Acres,Fire Agency,Yolo FD,101593404,Verizon,12000,Conductor,Overhead,Yes,7/1/2014 14:36,7/1/2014 14:36,Contact From Object,N.A.,Vehicle,Communication Facility,Human Error,,,,2014-07-01 00:14:00,7.6,11.2
46,46,7/1/2014,2014,7,1,12:18:43 AM,0,18,37.085421999999994,-121.76073799999999,Vegetation,Rural,< 0.25 Acres,Fire Agency,Cal Fire,"6770 Croy Rd, Morgan Hill", ,0 – 750,Conductor,Overhead,Yes,7/1/2014 18:43,7/1/2014 18:43,Equipment/ Facility Failure,Splice/Clamp/Connector,N.A.,N.A.,Unknown,,,,2014-07-01 00:18:00,24.1,24.1
47,47,7/2/2014,2014,7,2,12:13:17 AM,0,13,38.254571,-122.050928,Vegetation,Urban,< 0.25 Acres,Fire Agency,,101556512,AT&T,12000,Conductor,Overhead,Yes,7/2/2014 13:17,7/2/2014 13:17,Equipment/ Facility Failure,Conductor,N.A.,N.A.,Unknown,,,,2014-07-02 00:13:00,29.5,38.9
48,48,7/2/2014,2014,7,2,12:14:29 AM,0,14,40.473659999999995,-122.47373,Vegetation,Rural,< 0.25 Acres,Fire Agency,Cal Fire,101481261,TDS HAPPY VALLEY,12000,Conductor,Overhead,Yes,7/2/2014 14:29,7/2/2014 14:29,Vandalism/Theft,N.A.,N.A.,N.A.,Human Error,Third-party caused,,,2014-07-02 00:14:00,29.5,29.5
49,49,7/2/2014,2014,7,2,12:17:17 AM,0,17,35.053351,-119.40879,Vegetation,Rural,< 0.25 Acres,Fire Agency,,Mtr. 1004492840, ,0 – 750,Transformer,Overhead,Yes,7/2/2014 17:17,7/2/2014 17:17,Equipment/ Facility Failure,Transformer,N.A.,N.A.,Unknown,,,,2014-07-02 00:17:00,16.6,18.4
50,50,7/3/2014,2014,7,3,12:11:37 AM,0,11,37.334884,-120.851017,Vegetation,Rural,< 0.25 Acres,Unknown,,101207072,AT&T,12000,Conductor,Overhead,Yes,7/3/2014 11:37,7/3/2014 11:37,Equipment/ Facility Failure,Conductor,N.A.,N.A.,Unknown,,,,2014-07-03 00:11:00,no data,18.4
51,51,7/3/2014,2014,7,3,12:19:22 AM,0,19,39.491453,-121.53846899999999,Vegetation,Rural,< 0.25 Acres,Unknown,,100369965, ,12000,Other,Subsurface,Yes,7/3/2014 19:22,7/3/2014 19:22,Equipment/ Facility Failure,Other,N.A.,N.A.,Unknown,,,,2014-07-03 00:19:00,14.8,14.8
52,52,7/3/2014,2014,7,3,12:20:28 AM,0,20,40.658384000000005,-122.321476,Vegetation,Rural,< 0.25 Acres,Fire Agency,Cal Fire,T1192, ,12000,Other,Padmounted,Yes,7/3/2014 20:28,7/3/2014 20:28,Equipment/ Facility Failure,Other,N.A.,N.A.,Unknown,,,,2014-07-03 00:20:00,22.3,22.3
53,53,7/4/2014,2014,7,4,12:01:40 AM,0,1,39.333723,-121.13913799999999,Vegetation,Rural,.26 - 9.99 Acres,Fire Agency,Cal Fire,100001697, ,12000,Transformer,Overhead,Yes,7/4/2014 1:40,7/4/2014 1:40,Equipment/ Facility Failure,Transformer,N.A.,N.A.,Unknown,,,,2014-07-04 00:01:00,9.4,13.0
54,54,7/4/2014,2014,7,4,12:06:52 AM,0,6,37.184019,-121.74160400000001,Vegetation,Rural,< 3 meters ,Unknown,,Sw 73367, ,21000,Other,Overhead,Yes,7/4/2014 6:52,7/4/2014 6:52,Unknown,N.A.,N.A.,N.A.,Unknown,,,,2014-07-04 00:06:00,22.3,22.3
55,55,7/5/2014,2014,7,5,12:03:30 AM,0,3,35.45955,-120.72915,Vegetation,Rural,< 0.25 Acres,Fire Agency,Cal Fire,101934121, ,12000,Conductor,Overhead,Yes,7/5/2014 3:30,7/5/2014 3:30,Contact From Object,N.A.,Vegetation,Electric Facility,Unknown,,,,2014-07-05 00:03:00,27.7,31.7
57,57,7/5/2014,2014,7,5,12:10:09 AM,0,10,39.778538,-121.59003799999999,Vegetation,Rural,< 0.25 Acres,Fire Agency,Butte County FD,100399511, ,12000,Transformer,Overhead,Yes,7/5/2014 10:09,7/5/2014 10:09,Contact From Object,N.A.,Animal,Electric Facility,Unknown,,,,2014-07-05 00:10:00,27.7,36.0
58,58,7/5/2014,2014,7,5,12:23:17 AM,0,23,39.81977,-121.626222,Vegetation,Rural,< 0.25 Acres,Fire Agency,,100355517, ,12000,Conductor,Overhead,Yes,7/5/2014 23:17,7/5/2014 23:17,Contact From Object,N.A.,Vegetation,Electric Facility,Unknown,,,,2014-07-05 00:23:00,27.7,36.0
59,59,7/6/2014,2014,7,6,12:17:00 AM,0,17,37.94690999,-122.09360900000001,Vegetation,Rural,< 0.25 Acres,Fire Agency,Contra Costa FD,100460181,AT&T,0 – 750,Conductor,Overhead,No, , ,Unknown,N.A.,N.A.,N.A.,Unknown,,,,2014-07-06 00:17:00,no data,36.0
60,60,7/6/2014,2014,7,6,12:19:19 AM,0,19,38.7489,-123.28498,Vegetation,Rural,.26 - 9.99 Acres,Fire Agency,Cal Fire,6 SPANS FROM EOL TWD FUCO 4605,  ,12000,Conductor,Overhead,Yes,7/6/2014 19:19,7/6/2014 19:19,Contact From Object,N.A.,Vegetation,Electric Facility,Unknown,,,,2014-07-06 00:19:00,22.3,22.3
61,61,7/7/2014,2014,7,7,12:20:43 AM,0,20,36.84939,-119.87998600000002,Vegetation,Urban,< 0.25 Acres,Fire Agency,,NE of D9200, ,21000,Conductor,Overhead,Yes,7/7/2014 20:43,7/7/2014 20:43,Contact From Object,N.A.,Other,Electric Facility,Human Error,suspect large crane,,,2014-07-07 00:20:00,0.0,20.5
62,62,7/7/2014,2014,7,7,12:23:49 AM,0,23,37.032664000000004,-120.310476,Vegetation,Rural,< 0.25 Acres,Fire Agency,Cal Fire,101090847,AT&T,12000,Conductor,Overhead,Yes,7/7/2014 23:49,7/7/2014 23:49,Equipment/ Facility Failure,Conductor,N.A.,N.A.,Unknown,,,,2014-07-07 00:23:00,14.8,14.8
63,63,7/8/2014,2014,7,8,12:11:07 AM,0,11,37.905357,-121.21985,Vegetation,Rural,< 0.25 Acres,Unknown,,102131509, ,12000,Capacitor Bank,Overhead,Yes,7/8/2014 11:07,7/8/2014 11:07,Equipment/ Facility Failure,Capacitor Bank,N.A.,N.A.,Unknown,,,,2014-07-08 00:11:00,13.0,13.0
64,64,7/8/2014,2014,7,8,12:11:41 AM,0,11,36.701613,-121.57681299999999,Vegetation,Rural,< 0.25 Acres,Unknown,,101722884,AT&T,12000,Conductor,Overhead,Yes,7/8/2014 11:41,7/8/2014 11:41,Contact From Object,N.A.,Vegetation,Electric Facility,Human Error,Third-party caused,,,2014-07-08 00:11:00,no data,13.0
65,65,7/8/2014,2014,7,8,12:12:34 AM,0,12,36.3905,-121.61475,Vegetation,Rural,< 0.25 Acres,Fire Agency,Cal Fire,5 SPANS BEYOND FU-9383, ,12000,Conductor,Overhead,Yes,7/8/2014 12:34,7/8/2014 12:34,Contact From Object,N.A.,Vegetation,Electric Facility,Unknown,,,,2014-07-08 00:12:00,no data,13.0
66,66,7/8/2014,2014,7,8,12:22:39 AM,0,22,39.0437,-120.59052,Vegetation,Rural,< 0.25 Acres,Fire Agency,Cal Fire,22640 PLUMTREE RD, ,12000,Conductor,Overhead,Yes,7/8/2014 22:39,7/8/2014 22:39,Contact From Object,N.A.,Vegetation,Electric Facility,Unknown,,,,2014-07-08 00:22:00,9.4,11.2
67,67,7/9/2014,2014,7,9,12:14:42 AM,0,14,38.605789,-120.71175500000001,Vegetation,Rural,< 0.25 Acres,Fire Agency,Cal Fire,"6851 Mount Aukum Rd, Somerset", ,0 – 750,Conductor,Overhead,No, , ,Unknown,N.A.,N.A.,N.A.,Unknown,,,,2014-07-09 00:14:00,9.4,16.6
68,68,7/10/2014,2014,7,10,12:14:37 AM,0,14,39.23185,-123.13989,Vegetation,Rural,< 0.25 Acres,Unknown,,MTR 1009774604, ,12000,Conductor,Overhead,Yes,7/10/2014 14:37,7/10/2014 14:37,Contact From Object,N.A.,Vegetation,Electric Facility,Unknown,,,,2014-07-10 00:14:00,16.6,22.3
69,69,7/11/2014,2014,7,11,12:01:42 AM,0,1,39.212134000000006,-121.29776499999998,Vegetation,Rural,.26 - 9.99 Acres,Fire Agency,Cal Fire,Pole 000/006, ,60000,Conductor,Overhead,Yes,7/11/2014 1:42,7/11/2014 1:42,Contact From Object,N.A.,Animal,Electric Facility,Unknown,,,,2014-07-11 00:01:00,18.4,18.4
70,70,7/11/2014,2014,7,11,12:14:07 AM,0,14,36.94562,-121.76684099999999,Vegetation,Urban,< 0.25 Acres,Fire Agency,Cal Fire,101709439, ,21000,Conductor,Overhead,Yes,7/11/2014 14:07,7/11/2014 14:07,Contact From Object,N.A.,Balloons,Electric Facility,Human Error,,,,2014-07-11 00:14:00,18.4,24.1
71,71,7/11/2014,2014,7,11,12:15:15 AM,0,15,38.9108,-122.009979,Vegetation,Rural,.26 - 9.99 Acres,Unknown,,101651518, ,12000,Transformer,Overhead,Yes,7/11/2014 15:15,7/11/2014 15:15,Equipment/ Facility Failure,Transformer,N.A.,N.A.,Unknown,,,,2014-07-11 00:15:00,20.5,20.5
72,72,7/11/2014,2014,7,11,12:21:56 AM,0,21,37.89526,-121.85703999999998,Vegetation,Rural,< 0.25 Acres,Fire Agency,Contra Costa FD,102347574,AT&T,21000,Conductor,Overhead,Yes,7/11/2014 21:56,7/11/2014 21:56,Contact From Object,N.A.,Vehicle,Pole,Human Error,,,,2014-07-11 00:21:00,no data,20.5
73,73,7/12/2014,2014,7,12,12:16:25 AM,0,16,36.535902,-121.417331,Vegetation,Rural,< 0.25 Acres,Fire Agency,,Mtr. 1006729371, ,12000,Conductor,Overhead,Yes,7/12/2014 16:25,7/12/2014 16:25,Equipment/ Facility Failure,Splice/Clamp/Connector,N.A.,N.A.,Unknown,,,,2014-07-12 00:16:00,no data,20.5
74,74,7/12/2014,2014,7,12,12:19:52 AM,0,19,40.777947,-121.99967,Vegetation,Rural,< 0.25 Acres,Fire Agency,,6 SPANS E/OF MTR 5000068877, ,12000,Conductor,Overhead,Yes,7/12/2014 19:52,7/12/2014 19:52,Contact From Object,N.A.,Vegetation,Electric Facility,Unknown,,,,2014-07-12 00:19:00,18.4,18.4
75,75,7/13/2014,2014,7,13,12:18:42 AM,0,18,38.975570000000005,-123.68068000000001,Vegetation,Rural,< 0.25 Acres,Fire Agency,Cal Fire,43712 CRISPIN RD, ,12000,Conductor,Overhead,Yes,7/13/2014 18:42,7/13/2014 18:42,Contact From Object,N.A.,Vegetation,Electric Facility,Unknown,,,,2014-07-13 00:18:00,16.6,16.6
76,76,7/14/2014,2014,7,14,12:09:36 AM,0,9,37.983222,-122.06961100000001,Vegetation,Urban,< 0.25 Acres,Customer,,100460487,AT&T,21000,Conductor,Overhead,Yes,7/14/2014 9:36,7/14/2014 9:36,Equipment/ Facility Failure,Conductor,N.A.,N.A.,Unknown,,,,2014-07-14 00:09:00,no data,16.6
77,77,7/14/2014,2014,7,14,12:16:41 AM,0,16,37.536178,-122.294979,Vegetation,Urban,< 0.25 Acres,Unknown,,100271153,AT&T,0 – 750,Conductor,Overhead,No, , ,Contact From Object,N.A.,Balloons,Electric Facility,Human Error,,,,2014-07-14 00:16:00,14.8,18.4
78,78,7/15/2014,2014,7,15,12:09:00 AM,0,9,38.4189,-120.5195,Vegetation,Rural,.26 - 9.99 Acres,Fire Agency,Cal Fire,101244892, ,12000,Conductor,Overhead,Yes,7/15/2014 9:00,7/15/2014 9:00,Contact From Object,N.A.,Vegetation,Electric Facility,Unknown,,,,2014-07-15 00:09:00,no data,18.4
79,79,7/15/2014,2014,7,15,12:16:32 AM,0,16,38.255765999999994,-122.04873400000001,Vegetation,Urban,< 0.25 Acres,Fire Agency,,"1244 Grant St, Fairfield", ,0 – 750,Conductor,Overhead,No, , ,Unknown,N.A.,N.A.,N.A.,Unknown,,,,2014-07-15 00:16:00,37.1,37.1
80,80,7/16/2014,2014,7,16,12:01:29 AM,0,1,38.736277,-121.43654,Vegetation,Rural,.26 - 9.99 Acres,Unknown,,100102912, ,12000,Unknown,Overhead,Yes,7/16/2014 1:29,7/16/2014 1:29,Unknown,N.A.,N.A.,N.A.,Unknown,,,,2014-07-16 00:01:00,18.4,20.5
81,81,7/17/2014,2014,7,17,12:13:56 AM,0,13,35.2421,-119.105,Vegetation,Rural,< 0.25 Acres,Fire Agency,Cal Fire,1 POLE E/OF NORIEGA AND HEATH, ,21000,Conductor,Overhead,Yes,7/17/2014 13:56,7/17/2014 13:56,Contact From Object,N.A.,Vegetation,Electric Facility,Unknown,,,,2014-07-17 00:13:00,22.3,24.1
82,82,7/17/2014,2014,7,17,12:15:14 AM,0,15,39.810434,-122.32999,Vegetation,Rural,.26 - 9.99 Acres,Fire Agency,Cal Fire, 1 POLE W/OF MTR #1008817785, ,12000,Conductor,Overhead,Yes,7/17/2014 15:14,7/17/2014 15:14,Contact From Object,N.A.,Animal,Electric Facility,Unknown,,,,2014-07-17 00:15:00,16.6,22.3
83,83,7/17/2014,2014,7,17,12:17:24 AM,0,17,37.374826,-122.08246899999999,Vegetation,Urban,< 3 meters ,Unknown,,3P N/O 1715, ,12000,Conductor,Overhead,Yes,7/17/2014 17:24,7/17/2014 17:24,Contact From Object,N.A.,Vegetation,Electric Facility,Unknown,,,,2014-07-17 00:17:00,35.3,35.3
85,85,7/20/2014,2014,7,20,12:12:23 AM,0,12,37.676078000000004,-119.796926,Vegetation,Rural,.26 - 9.99 Acres,Fire Agency,NPS,Twr. 038/224, ,70000,Conductor,Overhead,Yes,7/20/2014 12:23,7/20/2014 12:23,Contact From Object,N.A.,Other,Electric Facility,Weather,lightning strike,,,2014-07-20 00:12:00,,
86,86,7/20/2014,2014,7,20,12:12:44 AM,0,12,38.393139,-121.59374,Vegetation,Rural,< 0.25 Acres,Unknown,,101652420, ,21000,Conductor,Overhead,Yes,7/20/2014 12:44,7/20/2014 12:44,Contact From Object,N.A.,Animal,Electric Facility,Unknown,,,,2014-07-20 00:12:00,16.6,16.6
87,87,7/21/2014,2014,7,21,12:09:57 AM,0,9,37.592890000000004,-121.341672,Vegetation,Rural,< 0.25 Acres,Fire Agency,,"3401 Gaffery Rd, Vernalis", ,12000,Conductor,Overhead,Yes,7/21/2014 9:57,7/21/2014 9:57,Contact From Object,N.A.,Animal,Electric Facility,Unknown,,,,2014-07-21 00:09:00,no data,16.6
88,88,7/22/2014,2014,7,22,12:14:53 AM,0,14,37.06857999,-121.66955,Vegetation,Rural,< 0.25 Acres,Unknown,,100607514,Verizon,0 – 750,Conductor,Overhead,No, , ,Unknown,N.A.,N.A.,N.A.,Unknown,,,,2014-07-22 00:14:00,16.6,24.1
89,89,7/22/2014,2014,7,22,12:20:09 AM,0,20,37.951628,-120.45971899999999,Vegetation,Rural,< 0.25 Acres,Unknown,,101012452, ,0 – 750,Conductor,Overhead,Yes,7/22/2014 20:09,7/22/2014 20:09,Equipment/ Facility Failure,Other,N.A.,N.A.,Unknown,,,,2014-07-22 00:20:00,,
91,91,7/24/2014,2014,7,24,12:01:04 AM,0,1,37.081274,-122.14258400000001,Vegetation,Rural,< 3 meters ,Fire Agency,Cal Fire,1 SP SS OF MTR 1008516620, ,12000,Conductor,Overhead,Yes,7/24/2014 1:04,7/24/2014 1:04,Contact From Object,N.A.,Vegetation,Electric Facility,Unknown,,,,2014-07-24 00:01:00,9.4,22.3
92,92,7/24/2014,2014,7,24,12:10:59 AM,0,10,40.024003,-122.09558999999999,Vegetation,Rural,< 0.25 Acres,Fire Agency,Cal Fire,101537326,AT&T,0 – 750,Conductor,Overhead,No, , ,Contact From Object,N.A.,Vegetation,Electric Facility,Unknown,,,,2014-07-24 00:10:00,11.2,14.8
93,93,7/24/2014,2014,7,24,12:11:56 AM,0,11,38.39147,-122.93053,Vegetation,Rural,.26 - 9.99 Acres,Fire Agency,Cal Fire,2 SPANS LOAD SIDE OF 1691, ,12000,Conductor,Overhead,Yes,7/24/2014 11:56,7/24/2014 11:56,Contact From Object,N.A.,Vegetation,Electric Facility,Unknown,,,,2014-07-24 00:11:00,16.6,18.4
94,94,7/24/2014,2014,7,24,12:15:26 AM,0,15,37.446539,-122.271934,Vegetation,Rural,.26 - 9.99 Acres,Fire Agency,,Pole 000/019,AT&T,60000,Conductor,Overhead,Yes,7/24/2014 15:26,7/24/2014 15:26,Contact From Object,N.A.,Vegetation,Electric Facility,Unknown,,,,2014-07-24 00:15:00,24.1,24.1
95,95,7/24/2014,2014,7,24,12:15:51 AM,0,15,39.836831,-121.70389399999999,Vegetation,Rural,< 0.25 Acres,Fire Agency,Cal Fire,4 & 5 POLES S/OF LR 2028, ,12000,Conductor,Overhead,Yes,7/24/2014 15:51,7/24/2014 15:51,Contact From Object,N.A.,Vegetation,Electric Facility,Unknown,,,,2014-07-24 00:15:00,18.4,27.7
96,96,7/24/2014,2014,7,24,12:19:28 AM,0,19,39.045003,-121.172794,Vegetation,Rural,.26 - 9.99 Acres,Unknown,,"16243 Tierra Rd, Grass Valley", ,12000,Conductor,Overhead,Yes,7/24/2014 19:28,7/24/2014 19:28,Contact From Object,N.A.,Vegetation,Electric Facility,Unknown,,,,2014-07-24 00:19:00,3.6,14.8
97,97,7/25/2014,2014,7,25,12:12:16 AM,0,12,39.649153000000005,-121.871357,Vegetation,Rural,< 3 meters ,Unknown,,100356542, ,0 – 750,Conductor,Overhead,No, , ,Unknown,N.A.,N.A.,N.A.,Unknown,,,,2014-07-25 00:12:00,18.4,36.0
98,98,7/26/2014,2014,7,26,12:05:02 AM,0,5,39.26145,-121.57458999999999,Vegetation,Rural,< 0.25 Acres,Self Extinguished,,Twr. 001/110, ,115000,Other,Overhead,Yes,7/26/2014 5:02,7/26/2014 5:02,Unknown,N.A.,N.A.,N.A.,Unknown,,,,2014-07-26 00:05:00,5.4,9.4
99,99,7/26/2014,2014,7,26,12:15:26 AM,0,15,37.66550999,-119.84165,Vegetation,Rural,1000 - 4999 Acres,Fire Agency,NPS,101084253, ,12000,Conductor,Overhead,Yes,7/26/2014 15:26,7/26/2014 15:26,Contact From Object,N.A.,Vegetation,Electric Facility,Unknown,,,,2014-07-26 00:15:00,no data,9.4
101,101,7/27/2014,2014,7,27,12:06:54 AM,0,6,35.60047,-121.11548,Vegetation,Rural,.26 - 9.99 Acres,Fire Agency,Cal Fire,MAIN LINE LOAD SIDE FUSE TAP 5027, ,12000,Conductor,Overhead,Yes,7/27/2014 6:54,7/27/2014 6:54,Equipment/ Facility Failure,Conductor,N.A.,N.A.,Unknown,,,,2014-07-27 00:06:00,37.1,37.1
102,102,7/27/2014,2014,7,27,12:16:30 AM,0,16,35.572014,-121.057898,Vegetation,Rural,< 0.25 Acres,Fire Agency,,Pole 014/099, ,70000,Conductor,Overhead,Yes,7/27/2014 16:30,7/27/2014 16:30,Equipment/ Facility Failure,Other,N.A.,N.A.,Unknown,,,,2014-07-27 00:16:00,37.1,37.1
103,103,7/27/2014,2014,7,27,12:17:40 AM,0,17,37.44818,-119.909498,Vegetation,Rural,.26 - 9.99 Acres,Fire Agency,,101087619, ,21000,Conductor,Overhead,Yes,7/27/2014 17:40,7/27/2014 17:40,Other,N.A.,N.A.,N.A.,Outside Force,woodpecker damage,,,2014-07-27 00:17:00,14.8,14.8
105,105,7/28/2014,2014,7,28,12:16:00 AM,0,16,37.68553,-121.731329,Vegetation,Urban,< 3 meters ,Unknown,,"967 Lynn St, Liverfmore", ,12000,Conductor,Overhead,Yes,7/28/2014 16:00,7/28/2014 16:00,Equipment/ Facility Failure,Conductor,N.A.,N.A.,Unknown,,,,2014-07-28 00:16:00,16.6,25.9
106,106,7/28/2014,2014,7,28,12:19:05 AM,0,19,39.66819,-123.64416999999999,Vegetation,Rural,< 0.25 Acres,Fire Agency,Cal Fire,MM 11.25, ,12000,Conductor,Overhead,Yes,7/28/2014 19:05,7/28/2014 19:05,Contact From Object,N.A.,Vegetation,Electric Facility,Unknown,,,,2014-07-28 00:19:00,13.0,18.4
107,107,7/30/2014,2014,7,30,12:04:36 AM,0,4,36.876504,-121.664597,Vegetation,Rural,< 0.25 Acres,Unknown,,101699196,AT&T,21000,Conductor,Overhead,Yes,7/30/2014 4:36,7/30/2014 4:36,Contact From Object,N.A.,Animal,Electric Facility,Unknown,,,,2014-07-30 00:04:00,11.2,16.6
108,108,7/30/2014,2014,7,30,12:10:42 AM,0,10,39.328624,-121.383645,Vegetation,Rural,< 0.25 Acres,Unknown,,101292419, ,12000,Conductor,Overhead,Yes,7/30/2014 10:42,7/30/2014 10:42,Equipment/ Facility Failure,Conductor,N.A.,N.A.,Unknown,,,,2014-07-30 00:10:00,13.0,14.8
109,109,7/30/2014,2014,7,30,12:17:35 AM,0,17,38.648293,-120.69308600000001,Vegetation,Rural,< 0.25 Acres,Fire Agency,Cal Fire,101403817,AT&T,21000,Unknown,Overhead,Yes,7/30/2014 17:35,7/30/2014 17:35,Equipment/ Facility Failure,Voltage Regulator,N.A.,N.A.,Unknown,,,,2014-07-30 00:17:00,7.6,13.0
110,110,7/31/2014,2014,7,31,12:12:41 AM,0,12,37.87822,-122.463394,Vegetation,Urban,< 0.25 Acres,Fire Agency,Tiburon,102295755, ,12000,Conductor,Overhead,Yes,7/31/2014 12:41,7/31/2014 12:41,Contact From Object,N.A.,Vehicle,Pole,Human Error,,,,2014-07-31 00:12:00,25.9,27.7
111,111,7/31/2014,2014,7,31,12:15:00 AM,0,15,39.04242,-122.92058999999999,Vegetation,Urban,< 0.25 Acres,Fire Agency,Lakeport Fire Dept.,102164900,AT&T,0 – 750,Conductor,Overhead,Yes,7/31/2014 15:00,7/31/2014 15:00,Contact From Object,N.A.,Vegetation,Electric Facility,Unknown,,,,2014-07-31 00:15:00,18.4,18.4
112,112,7/31/2014,2014,7,31,12:22:08 AM,0,22,38.534279999999995,-120.05708,Vegetation,Rural,.26 - 9.99 Acres,Unknown,,4 SPANS SOUTH OF LR-2404, ,12000,Conductor,Overhead,Yes,7/31/2014 22:08,7/31/2014 22:08,Contact From Object,N.A.,Vegetation,Electric Facility,Unknown,,,,2014-07-31 00:22:00,5.4,20.5
113,113,8/1/2014,2014,8,1,12:16:17 AM,0,16,39.62531999,-121.45238,Vegetation,Rural,< 0.25 Acres,Unknown,,709 Encina Grande Road, ,0 – 750,Other,Overhead,No, , ,Unknown,N.A.,N.A.,N.A.,Unknown,,,,2014-08-01 00:16:00,14.8,14.8
114,114,8/2/2014,2014,8,2,12:00:04 AM,0,0,37.606314000000005,-122.389831,Vegetation,Urban,< 0.25 Acres,Unknown,,Twr. 000/002, ,115000,Conductor,Overhead,Yes,8/2/2014 0:04,8/2/2014 0:04,Contact From Object,N.A.,Balloons,Electric Facility,Human Error,,,,2014-08-02 00:00:00,35.3,35.3
115,115,8/2/2014,2014,8,2,12:10:38 AM,0,10,36.61184,-119.30568000000001,Vegetation,Rural,< 0.25 Acres,Unknown,,100710225, ,12000,Fuse,Overhead,Yes,8/2/2014 10:38,8/2/2014 10:38,Contact From Object,N.A.,Animal,Electric Facility,Unknown,,,,2014-08-02 00:10:00,14.8,20.5
116,116,8/3/2014,2014,8,3,12:16:11 AM,0,16,39.644375,-121.78803300000001,Vegetation,Rural,< 0.25 Acres,Unknown,,MTR 1007460127,  ,12000,Conductor,Overhead,Yes,8/3/2014 16:11,8/3/2014 16:11,Contact From Object,N.A.,Vegetation,Electric Facility,Unknown,,,,2014-08-03 00:16:00,22.3,22.3
117,117,8/4/2014,2014,8,4,12:04:18 AM,0,4,37.10625999,-121.636669,Vegetation,Urban,< 0.25 Acres,Fire Agency,Cal Fire,100606026,Verizon,21000,Conductor,Overhead,No, , ,Contact From Object,N.A.,Vehicle,Communication Facility,Human Error,,,,2014-08-04 00:04:00,25.9,25.9
118,118,8/5/2014,2014,8,5,12:00:08 AM,0,0,38.78045999,-121.489369,Vegetation,Rural,< 0.25 Acres,Fire Agency,,101297005, ,12000,Conductor,Overhead,Yes,8/5/2014 0:08,8/5/2014 0:08,Equipment/ Facility Failure,Splice/Clamp/Connector,N.A.,N.A.,Unknown,,,,2014-08-05 00:00:00,7.6,13.0
119,119,8/5/2014,2014,8,5,12:02:57 AM,0,2,38.57043,-121.10226999999999,Vegetation,Rural,< 0.25 Acres,Unknown,,7150 MEARS DR #A AUBURN, ,12000,Conductor,Overhead,Yes,8/5/2014 2:57,8/5/2014 2:57,Contact From Object,N.A.,Vegetation,Electric Facility,Unknown,,,,2014-08-05 00:02:00,0.0,0.0
120,120,8/5/2014,2014,8,5,12:12:03 AM,0,12,39.215499,-121.302929,Vegetation,Rural,.26 - 9.99 Acres,Fire Agency,Cal Fire,Str. 010/122, ,60000,Conductor,Overhead,Yes,8/5/2014 12:03,8/5/2014 12:03,Contact From Object,N.A.,Animal,Electric Facility,Unknown,,,,2014-08-05 00:12:00,13.0,13.0
121,121,8/5/2014,2014,8,5,12:14:50 AM,0,14,37.34196999,-121.63198999999999,Vegetation,Rural,< 0.25 Acres,Fire Agency,Cal Fire,MTR 1009312709, ,0 – 750,Transformer,Overhead,Yes,8/5/2014 14:50,8/5/2014 14:50,Equipment/ Facility Failure,Transformer,N.A.,N.A.,Unknown,,,,2014-08-05 00:14:00,27.7,27.7
122,122,8/5/2014,2014,8,5,12:16:13 AM,0,16,37.56341,-119.9395,Vegetation,Rural,.26 - 9.99 Acres,Fire Agency,Cal Fire, MTR 1006385335, ,0 – 750,Conductor,Overhead,No, , ,Contact From Object,N.A.,Vegetation,Electric Facility,Unknown,,,,2014-08-05 00:16:00,16.6,18.4
123,123,8/5/2014,2014,8,5,12:17:12 AM,0,17,36.91875999,-119.67667,Vegetation,Rural,< 0.25 Acres,Fire Agency,Cal Fire,100725159, ,0 – 750,Conductor,Overhead,No, , ,Unknown,N.A.,N.A.,N.A.,Unknown,,,,2014-08-05 00:17:00,16.6,16.6
124,124,8/5/2014,2014,8,5,12:21:41 AM,0,21,38.00311,-122.32705,Vegetation,Urban,< 0.25 Acres,Fire Agency,Contra Costa FD,101426924, ,0 – 750,Conductor,Overhead,No, , ,Unknown,N.A.,N.A.,N.A.,Unknown,,,,2014-08-05 00:21:00,14.8,20.5
125,125,8/8/2014,2014,8,8,12:18:17 AM,0,18,40.00112,-122.226079,Vegetation,Rural,< 0.25 Acres,Fire Agency,Cal Fire,101530848, ,12000,Conductor,Overhead,Yes,8/8/2014 18:17,8/8/2014 18:17,Contact From Object,N.A.,Vehicle,Pole,Human Error,,,,2014-08-08 00:18:00,14.8,14.8
126,126,8/9/2014,2014,8,9,12:02:53 AM,0,2,38.3011,-122.89633,Vegetation,Rural,< 0.25 Acres,Unknown,,"2 SPANS SOURCE SIDE OF 30501 SHORLINE HWY, FALLON", ,12000,Conductor,Overhead,Yes,8/9/2014 2:53,8/9/2014 2:53,Contact From Object,N.A.,Vegetation,Electric Facility,Unknown,,,,2014-08-09 00:02:00,14.8,18.4
127,127,8/9/2014,2014,8,9,12:15:36 AM,0,15,36.685177,-119.04496,Vegetation,Rural,< 0.25 Acres,Fire Agency,Cal Fire,MTR#1005057583, ,12000,Conductor,Overhead,Yes,8/9/2014 15:36,8/9/2014 15:36,Contact From Object,N.A.,Vegetation,Electric Facility,Unknown,,,,2014-08-09 00:15:00,13.0,13.0
128,128,8/11/2014,2014,8,11,12:09:23 AM,0,9,37.911840000000005,-120.34889,Vegetation,Rural,.26 - 9.99 Acres,Fire Agency,Cal Fire,2 SPAN LOADSIDE FCO 20835, ,17000,Conductor,Overhead,Yes,8/11/2014 9:23,8/11/2014 9:23,Contact From Object,N.A.,Vegetation,Electric Facility,Unknown,,,,2014-08-11 00:09:00,11.2,13.0
129,129,8/11/2014,2014,8,11,12:14:35 AM,0,14,39.672523,-121.49831699999999,Vegetation,Rural,< 0.25 Acres,Unknown,,Twr 022/146, ,230000,Other,Overhead,Yes,8/11/2014 14:35,8/11/2014 14:35,Contact From Object,N.A.,Other,Electric Facility,Weather,lightning strike,,,2014-08-11 00:14:00,18.4,18.4
130,130,8/12/2014,2014,8,12,12:08:58 AM,0,8,36.74056999,-121.76763999999999,Vegetation,Rural,< 3 meters ,Unknown,,"S/S MONTE RD 4 SPANS S/O NASHUA RD, CASTROVILLE", ,21000,Other,Overhead,Yes,8/12/2014 8:58,8/12/2014 8:58,Equipment/ Facility Failure,Other,N.A.,N.A.,Unknown,,,,2014-08-12 00:08:00,no data,18.4
132,132,8/12/2014,2014,8,12,12:15:38 AM,0,15,38.77711,-120.26575,Vegetation,Rural,.26 - 9.99 Acres,Fire Agency,,WEST SIDE OF SW 6161, ,21000,Conductor,Overhead,Yes,8/12/2014 15:38,8/12/2014 15:38,Contact From Object,N.A.,Vegetation,Electric Facility,Unknown,,,,2014-08-12 00:15:00,9.4,9.4
133,133,8/14/2014,2014,8,14,12:10:46 AM,0,10,38.012395,-120.586052,Vegetation,Rural,< 3 meters ,Unknown,,101272971,AT&T,17000,Conductor,Overhead,Yes,8/14/2014 10:46,8/14/2014 10:46,Contact From Object,N.A.,Vegetation,Electric Facility,Unknown,,,,2014-08-14 00:10:00,9.4,9.4
134,134,8/14/2014,2014,8,14,12:14:57 AM,0,14,38.50990999,-122.83713,Vegetation,Rural,< 0.25 Acres,Fire Agency,,102028597,AT&T,0 – 750,Conductor,Overhead,Yes,8/14/2014 14:57,8/14/2014 14:57,Wire-Wire Contact,N.A.,N.A.,N.A.,Unknown,,,,2014-08-14 00:14:00,18.4,20.5
135,135,8/15/2014,2014,8,15,12:11:01 AM,0,11,40.5840531,-122.44469479999998,Vegetation,Rural,< 0.25 Acres,Fire Agency,Redding Fire Dept,101473764,AT&T,12000,Conductor,Overhead,Yes,8/15/2014 11:01,8/15/2014 11:01,Contact From Object,N.A.,Vegetation,Electric Facility,Unknown,,,,2014-08-15 00:11:00,16.6,16.6
136,136,8/16/2014,2014,8,16,12:07:30 AM,0,7,39.29385,-121.6378,Vegetation,Rural,< 0.25 Acres,Unknown,,mtr # 1007536106, ,12000,Conductor,Overhead,Yes,8/16/2014 7:30,8/16/2014 7:30,Contact From Object,N.A.,Vegetation,Electric Facility,Unknown,,,,2014-08-16 00:07:00,13.0,13.0
137,137,8/17/2014,2014,8,17,12:07:27 AM,0,7,37.32201999,-119.634469,Vegetation,Rural,< 0.25 Acres,Unknown,,RISER 10393, ,12000,Conductor,Overhead,Yes,8/17/2014 7:27,8/17/2014 7:27,Contact From Object,N.A.,Animal,Electric Facility,Unknown,,,,2014-08-17 00:07:00,11.2,11.2
140,140,8/19/2014,2014,8,19,12:21:05 AM,0,21,37.816508,-120.132182,Vegetation,Rural,< 3 meters ,Fire Agency,Groveland Fire,"23111 ELMORE RD, GROVELAND", ,17000,Conductor,Overhead,Yes,8/19/2014 21:05,8/19/2014 21:05,Contact From Object,N.A.,Vegetation,Electric Facility,Unknown,,,,2014-08-19 00:21:00,11.2,14.8
141,141,8/20/2014,2014,8,20,12:14:22 AM,0,14,38.83053999,-121.201419,Vegetation,Urban,< 0.25 Acres,Fire Agency,,100051560,AT&T,12000,Conductor,Overhead,Yes,8/20/2014 14:22,8/20/2014 14:22,Equipment/ Facility Failure,Splice/Clamp/Connector,N.A.,N.A.,Unknown,,,,2014-08-20 00:14:00,14.8,14.8
142,142,8/20/2014,2014,8,20,12:16:07 AM,0,16,40.193799,-123.76775500000001,Vegetation,Rural,.26 - 9.99 Acres,Fire Agency,Cal Fire,103316088, ,12000,Conductor,Overhead,Yes,8/20/2014 16:07,8/20/2014 16:07,Contact From Object,N.A.,Vegetation,Electric Facility,Unknown,,,,2014-08-20 00:16:00,22.3,25.9
143,143,8/21/2014,2014,8,21,12:00:00 AM,0,0,37.39646,-121.07158100000001,Vegetation,Rural,< 0.25 Acres,Unknown,,"Eastin Rd, south of Hwy 33, Crows Landing", ,12000,Conductor,Overhead,No, , ,Contact From Object,N.A.,Animal,Electric Facility,Unknown,,,,2014-08-21 00:00:00,7.6,13.0
144,144,8/23/2014,2014,8,23,12:08:36 AM,0,8,37.986259999999994,-120.391829,Vegetation,Urban,< 0.25 Acres,Fire Agency,Cal Fire,101049418,AT&T,17000,Conductor,Overhead,No, , ,Contact From Object,N.A.,Animal,Electric Facility,Unknown,,,,2014-08-23 00:08:00,11.2,20.5
145,145,8/24/2014,2014,8,24,12:11:08 AM,0,11,37.9417917,-121.318265,Vegetation,Urban,< 0.25 Acres,Fire Agency,Stockton FD,102109203,AT&T,12000,Conductor,Overhead,Yes,8/24/2014 11:08,8/24/2014 11:08,Contact From Object,N.A.,Animal,Electric Facility,Unknown,,,,2014-08-24 00:11:00,11.2,11.2
146,146,8/27/2014,2014,8,27,12:06:51 AM,0,6,38.36030999,-122.01778,Vegetation,Urban,< 0.25 Acres,Unknown,,"foothill w/o auburn, Vacaville", ,12000,Conductor,Overhead,Yes,8/27/2014 6:51,8/27/2014 6:51,Contact From Object,N.A.,Vehicle,Pole,Human Error,,,,2014-08-27 00:06:00,18.4,18.4
147,147,8/27/2014,2014,8,27,12:15:19 AM,0,15,38.59295,-122.91833000000001,Vegetation,Rural,< 0.25 Acres,Unknown,,3103 MILL CREEK RD, ,12000,Conductor,Overhead,Yes,8/27/2014 15:19,8/27/2014 15:19,Contact From Object,N.A.,Vegetation,Electric Facility,Unknown,,,,2014-08-27 00:15:00,16.6,16.6
148,148,8/28/2014,2014,8,28,12:00:00 AM,0,0,40.388624,-122.406849,Vegetation,Rural,< 3 meters ,Unknown,,"Gas Point Rd and Happy Valley Rd, Cottonwood",AT&T,0 – 750,Conductor,Overhead,No, , ,Equipment/ Facility Failure,Conductor,N.A.,N.A.,Unknown,,,,2014-08-28 00:00:00,20.5,20.5
149,149,8/28/2014,2014,8,28,12:13:51 AM,0,13,36.2607363,-119.85733,Vegetation,Rural,< 0.25 Acres,Fire Agency,,Pole 003/003, ,70000,Conductor,Overhead,Yes,8/28/2014 13:51,8/28/2014 13:51,Contact From Object,N.A.,Animal,Electric Facility,Unknown,,,,2014-08-28 00:13:00,9.4,11.2
150,150,8/29/2014,2014,8,29,12:19:21 AM,0,19,37.78712999,-120.763649,Vegetation,Rural,< 0.25 Acres,Fire Agency,Cal Fire,1 SP N/of 6567, ,17000,Conductor,Overhead,Yes,8/29/2014 19:21,8/29/2014 19:21,Contact From Object,N.A.,Vehicle,Pole,Human Error,,,,2014-08-29 00:19:00,11.2,18.4
151,151,8/30/2014,2014,8,30,12:12:08 AM,0,12,39.76108999,-121.85930900000001,Vegetation,Urban,< 0.25 Acres,Fire Agency,,100349953,AT&T,0 – 750,Conductor,Overhead,No, , ,Unknown,N.A.,N.A.,N.A.,Unknown,,,,2014-08-30 00:12:00,14.8,18.4
152,152,8/30/2014,2014,8,30,12:15:40 AM,0,15,37.6381467,-121.33341499999999,Vegetation,Rural,.26 - 9.99 Acres,Fire Agency,,102052361,AT&T,12000,Fuse,Overhead,Yes,8/30/2014 15:40,8/30/2014 15:40,Equipment/ Facility Failure,Fuse,N.A.,N.A.,Unknown,,,,2014-08-30 00:15:00,24.1,24.1
153,153,8/30/2014,2014,8,30,12:18:34 AM,0,18,37.35510999,-121.79786999999999,Vegetation,Rural,< 3 meters ,Unknown,,100575446,AT&T,0 – 750,Conductor,Overhead,No, , ,Wire-Wire Contact,N.A.,N.A.,N.A.,Unknown,,,,2014-08-30 00:18:00,18.4,18.4
154,154,8/31/2014,2014,8,31,12:02:12 AM,0,2,38.41937,-122.94963999999999,Vegetation,Rural,< 0.25 Acres,Unknown,,"2520 SteppsRd, Sebastopol", ,12000,Conductor,Overhead,Yes,8/31/2014 2:12,8/31/2014 2:12,Contact From Object,N.A.,Vegetation,Electric Facility,Unknown,,,,2014-08-31 00:02:00,14.8,22.3
155,155,9/1/2014,2014,9,1,12:15:58 AM,0,15,37.05996,-122.16628999999999,Vegetation,Rural,.26 - 9.99 Acres,Fire Agency,Cal Fire,At FUCO 2541, ,12000,Conductor,Overhead,Yes,9/1/2014 15:58,9/1/2014 15:58,Contact From Object,N.A.,Vegetation,Electric Facility,Unknown,,,,2014-09-01 00:15:00,11.2,16.6
156,156,9/2/2014,2014,9,2,12:03:49 AM,0,3,37.494625,-122.142408,Vegetation,Urban,< 0.25 Acres,Self Extinguished,,Pole 000/003, ,115000,Other,Overhead,Yes,9/2/2014 3:49,9/2/2014 3:49,Contamination,N.A.,N.A.,N.A.,Weather,,,,2014-09-02 00:03:00,no data,16.6
157,157,9/3/2014,2014,9,3,12:07:05 AM,0,7,38.302234999999996,-120.94743000000001,Vegetation,Rural,< 0.25 Acres,Fire Agency,Cal Fire,Fuse 8885, ,12000,Transformer,Overhead,Yes,9/3/2014 7:05,9/3/2014 7:05,Unknown,N.A.,N.A.,N.A.,Unknown,,,,2014-09-03 00:07:00,no data,16.6
158,158,9/3/2014,2014,9,3,12:13:21 AM,0,13,37.904096,-122.22965500000001,Vegetation,Rural,< 0.25 Acres,Fire Agency,Orinda FD,"10/N/OF Sw 8455, EAST OF WILDCAT CANYON ", ,12000,Conductor,Overhead,Yes,9/3/2014 13:21,9/3/2014 13:21,Contact From Object,N.A.,Vegetation,Electric Facility,Unknown,,,,2014-09-03 00:13:00,no data,16.6
159,159,9/4/2014,2014,9,4,12:00:34 AM,0,0,39.14509999,-122.08176999999999,Vegetation,Rural,< 0.25 Acres,Fire Agency,,5 POLES E/O MTR 1007307850, ,12000,Conductor,Overhead,Yes,9/4/2014 0:34,9/4/2014 0:34,Contact From Object,N.A.,Vehicle,Pole,Human Error,,,,2014-09-04 00:00:00,7.6,13.0
160,160,9/6/2014,2014,9,6,12:16:42 AM,0,16,37.87082,-121.38033670000002,Vegetation,Rural,.26 - 9.99 Acres,Fire Agency,Tracy FD,102064435, ,0 – 750,Conductor,Overhead,No, , ,Unknown,N.A.,N.A.,N.A.,Unknown,,,,2014-09-06 00:16:00,14.8,14.8
161,161,9/7/2014,2014,9,7,12:06:33 AM,0,6,36.59073999,-119.52115900000001,Vegetation,Rural,< 0.25 Acres,Fire Agency,Tulare County FD,100876971,AT&T,12000,Conductor,Overhead,Yes,9/7/2014 6:33,9/7/2014 6:33,Equipment/ Facility Failure,Splice/Clamp/Connector,N.A.,N.A.,Unknown,,,,2014-09-07 00:06:00,7.6,11.2
162,162,9/9/2014,2014,9,9,12:09:54 AM,0,9,39.15305999,-121.07706,Vegetation,Rural,< 0.25 Acres,Unknown,,100066768,AT&T,12000,Other,Overhead,Yes,9/9/2014 9:54,9/9/2014 9:54,Contact From Object,N.A.,Animal,Electric Facility,Unknown,,,,2014-09-09 00:09:00,9.4,14.8
163,163,9/10/2014,2014,9,10,12:00:00 AM,0,0,39.18496,-121.68869,Vegetation,Rural,< 0.25 Acres,Unknown,,"North Township Rd, Sutter", ,0 – 750,Other,Overhead,No, , ,Unknown,N.A.,N.A.,N.A.,Unknown,,,,2014-09-10 00:00:00,7.6,7.6
164,164,9/11/2014,2014,9,11,12:11:39 AM,0,11,38.538309999999996,-121.06508999999998,Vegetation,Rural,.26 - 9.99 Acres,Unknown,,"1001 BONNIE LN, AUBURN CA", ,12000,Conductor,Overhead,Yes,9/11/2014 11:39,9/11/2014 11:39,Contact From Object,N.A.,Vegetation,Electric Facility,Unknown,,,,2014-09-11 00:11:00,0.0,9.4
165,165,9/12/2014,2014,9,12,12:05:20 AM,0,5,38.028151,-121.175164,Vegetation,Rural,< 0.25 Acres,Unknown,,102127295,AT&T,12000,Conductor,Overhead,Yes,9/12/2014 5:20,9/12/2014 5:20,Equipment/ Facility Failure,Splice/Clamp/Connector,N.A.,N.A.,Unknown,,,,2014-09-12 00:05:00,18.4,18.4
166,166,9/13/2014,2014,9,13,12:17:25 AM,0,17,37.536187,-120.490003,Vegetation,Rural,< 0.25 Acres,Fire Agency,Merced FD,"376 Keyes Rd, Merced", ,0 – 750,Conductor,Overhead,Yes,9/13/2014 17:25,9/13/2014 17:25,Contact From Object,N.A.,Vegetation,Electric Facility,Unknown,,,,2014-09-13 00:17:00,22.3,22.3
167,167,9/14/2014,2014,9,14,12:14:47 AM,0,14,37.69849,-120.18706999999999,Vegetation,Rural,.26 - 9.99 Acres,Fire Agency,Cal Fire,Mtr 1006736074, ,21000,Conductor,Overhead,Yes,9/14/2014 14:47,9/14/2014 14:47,Equipment/ Facility Failure,Insulator,N.A.,N.A.,Unknown,,,,2014-09-14 00:14:00,7.6,11.2
168,168,9/15/2014,2014,9,15,12:19:22 AM,0,19,37.24514999,-122.00960900000001,Vegetation,Urban,< 3 meters ,Fire Agency,,15200 FRUITVALE AVE, ,12000,Conductor,Overhead,Yes,9/15/2014 19:22,9/15/2014 19:22,Contact From Object,N.A.,Vegetation,Electric Facility,Unknown,,,,2014-09-15 00:19:00,16.6,18.4
169,169,9/16/2014,2014,9,16,12:12:56 AM,0,12,38.451817999999996,-122.372941,Vegetation,Rural,< 0.25 Acres,Fire Agency,Cal Fire,102254607,AT&T,21000,Unknown,Overhead,Yes,9/16/2014 12:56,9/16/2014 12:56,Contact From Object,N.A.,Vehicle,Communication Facility,Human Error,,,,2014-09-16 00:12:00,27.7,27.7
170,170,9/17/2014,2014,9,17,12:08:36 AM,0,8,36.83119,-121.55823999999998,Vegetation,Rural,.26 - 9.99 Acres,Fire Agency,,101720674, ,21000,Conductor,Overhead,Yes,9/17/2014 8:36,9/17/2014 8:36,Equipment/ Facility Failure,Splice/Clamp/Connector,N.A.,N.A.,Unknown,,,,2014-09-17 00:08:00,33.5,33.5
171,171,9/17/2014,2014,9,17,12:11:49 AM,0,11,39.757529999999996,-122.2202,Vegetation,Rural,.26 - 9.99 Acres,Fire Agency,,100367963,AT&T,12000,Conductor,Overhead,Yes,9/17/2014 11:49,9/17/2014 11:49,Contact From Object,N.A.,Vehicle,Pole,Human Error,,,,2014-09-17 00:11:00,18.4,18.4
172,172,9/17/2014,2014,9,17,12:14:47 AM,0,14,37.23044999,-121.90583899999999,Vegetation,Urban,< 0.25 Acres,Fire Agency,,100547281,AT&T,0 – 750,Other,Overhead,No, , ,Equipment/ Facility Failure,Transformer,N.A.,N.A.,Unknown,,,,2014-09-17 00:14:00,18.4,18.4
173,173,9/18/2014,2014,9,18,12:13:00 AM,0,13,39.552099,-121.90853,Vegetation,Rural,300 - 999 Acres,Fire Agency,Cal Fire,12th pole s/of Fuse 1619,None,12000,Conductor,Overhead,Yes,9/18/2014 13:00,9/18/2014 13:00,Equipment/ Facility Failure,Pole,N.A.,N.A.,Unknown,,,,2014-09-18 00:13:00,no data,18.4
174,174,9/19/2014,2014,9,19,12:08:44 AM,0,8,39.262,-121.37706999999999,Vegetation,Rural,< 0.25 Acres,Fire Agency,Cal Fire,1w/17927, ,12000,Conductor,Overhead,Yes,9/19/2014 8:44,9/19/2014 8:44,Contact From Object,N.A.,Animal,Electric Facility,Unknown,,,,2014-09-19 00:08:00,11.2,13.0
175,175,9/20/2014,2014,9,20,12:00:00 AM,0,0,38.563117999999996,-121.52748700000001,Vegetation,Urban,< 0.25 Acres,Fire Agency,West Sacramento FD,"Jefferson Blvd and Stone Blvd, West Sacramento", ,0 – 750,Lightning Arrestor,Overhead,No, , ,Equipment/ Facility Failure,Lightning Arrestor,N.A.,N.A.,Unknown,,,,2014-09-20 00:00:00,14.8,16.6
176,176,9/20/2014,2014,9,20,12:07:02 AM,0,7,37.45523,-122.25113,Vegetation,Urban,< 0.25 Acres,Unknown,,100300898,AT&T,12000,Conductor,Overhead,Yes,9/20/2014 7:02,9/20/2014 7:02,Contact From Object,N.A.,Vegetation,Electric Facility,Unknown,,,,2014-09-20 00:07:00,18.4,18.4
177,177,9/21/2014,2014,9,21,12:04:54 AM,0,4,39.68839333,-121.85414329999999,Vegetation,Rural,< 3 meters ,Fire Agency,Cal Fire,100438591, ,12000,Conductor,Overhead,Yes,9/21/2014 4:54,9/21/2014 4:54,Contact From Object,N.A.,Vegetation,Electric Facility,Unknown,,,,2014-09-21 00:04:00,36.0,36.0
178,178,9/23/2014,2014,9,23,12:10:05 AM,0,10,39.110385,-121.333828,Vegetation,Rural,.26 - 9.99 Acres,Fire Agency,Beale AFB,Pole 007/138, ,60000,Conductor,Overhead,Yes,9/23/2014 10:05,9/23/2014 10:05,Contact From Object,N.A.,Animal,Electric Facility,Unknown,,,,2014-09-23 00:10:00,5.4,9.4
179,179,9/23/2014,2014,9,23,12:10:53 AM,0,10,38.81503,-120.90241,Vegetation,Rural,< 0.25 Acres,Fire Agency,Cal Fire,6871 marshall rd   lotus, ,21000,Conductor,Overhead,Yes,9/23/2014 10:53,9/23/2014 10:53,Contact From Object,N.A.,Vegetation,Electric Facility,Human Error,Third-party caused,,,2014-09-23 00:10:00,13.0,13.0
180,180,9/25/2014,2014,9,25,12:02:58 AM,0,2,37.38868999,-121.99718999999999,Vegetation,Urban,< 0.25 Acres,Fire Agency,,100549375,AT&T,12000,Conductor,Overhead,Yes,9/25/2014 2:58,9/25/2014 2:58,Equipment/ Facility Failure,Splice/Clamp/Connector,N.A.,N.A.,Unknown,,,,2014-09-25 00:02:00,20.5,29.5
181,181,9/25/2014,2014,9,25,12:20:27 AM,0,20,35.4405,-118.8611,Vegetation,Rural,< 0.25 Acres,Unknown,,Riser 823277, ,12000,Conductor,Overhead,Yes,9/25/2014 20:27,9/25/2014 20:27,Equipment/ Facility Failure,Conductor,N.A.,N.A.,Unknown,,,,2014-09-25 00:20:00,11.2,11.2
182,182,9/27/2014,2014,9,27,12:14:03 AM,0,14,37.00031,-121.56573999999999,Vegetation,Urban,< 0.25 Acres,Unknown,,"Monteerey Rd x Las Animas Ave, Gilroy", ,0 – 750,Conductor,Overhead,No, , ,Contact From Object,N.A.,Balloons,Electric Facility,Human Error,,,,2014-09-27 00:14:00,20.5,22.3
183,183,9/27/2014,2014,9,27,12:17:54 AM,0,17,40.377357,-122.33858899999998,Vegetation,Rural,< 3 meters ,Unknown, ,MTR# 1009679394, ,12000,Conductor,Overhead,Yes,9/27/2014 17:54,9/27/2014 17:54,Contact From Object,N.A.,Vegetation,Electric Facility,Unknown,,,,2014-09-27 00:17:00,7.6,7.6
184,184,9/29/2014,2014,9,29,12:14:26 AM,0,14,36.79952999,-121.769279,Vegetation,Rural,< 0.25 Acres,Fire Agency,Monterey County FD,2 POLES SS 0F 5877, ,12000,Conductor,Overhead,Yes,9/29/2014 14:26,9/29/2014 14:26,Contact From Object,N.A.,Vehicle,Pole,Human Error,,,,2014-09-29 00:14:00,11.2,16.6
185,185,9/30/2014,2014,9,30,12:11:41 AM,0,11,37.076448299999996,-120.19655,Vegetation,Rural,< 0.25 Acres,Customer,,"22491 Fairmead Blvd, Chowchilla", ,0 – 750,Other,Overhead,No, , ,Equipment/ Facility Failure,Other,N.A.,N.A.,Unknown,,,,2014-09-30 00:11:00,,13.0
186,186,9/30/2014,2014,9,30,12:14:08 AM,0,14,37.53027,-122.32278000000001,Vegetation,Urban,< 3 meters ,Unknown,,100265805,AT&T,12000,Conductor,Overhead,Yes,9/30/2014 14:08,9/30/2014 14:08,Contact From Object,N.A.,Vegetation,Electric Facility,Unknown,,,,2014-09-30 00:14:00,18.4,18.4
187,187,10/1/2014,2014,10,1,12:12:02 AM,0,12,37.92481,-121.20843,Vegetation,Rural,< 3 meters ,Fire Agency,Stockton FD,"5252 E. Mariposa Rd, Stockton", ,0 – 750,Other,Overhead,No, , ,Unknown,N.A.,N.A.,N.A.,Unknown,,,,2014-10-01 00:12:00,16.6,20.5
188,188,10/1/2014,2014,10,1,12:12:18 AM,0,12,39.726058,-121.86048000000001,Vegetation,Urban,< 0.25 Acres,Fire Agency,Cal Fire,"1920 WEBB AVE, Chico", ,0 – 750,Conductor,Overhead,No, , ,Contact From Object,N.A.,Vegetation,Electric Facility,Unknown,,,,2014-10-01 00:12:00,22.3,43.2
189,189,10/1/2014,2014,10,1,12:13:24 AM,0,13,37.550504,-122.30508300000001,Vegetation,Urban,< 0.25 Acres,Fire Agency,,"2030 So. Delaware, San Mateo", ,12000,Conductor,Overhead,Yes,10/1/2014 13:24,10/1/2014 13:24,Contact From Object,N.A.,Vehicle,Communication Facility,Human Error,,,,2014-10-01 00:13:00,14.8,14.8
190,190,10/1/2014,2014,10,1,12:15:04 AM,0,15,35.6316,-119.256805,Vegetation,Rural,< 0.25 Acres,Unknown,,"Service pole at SW SW 26 26 25, Wasco",,0 – 750,Conductor,Overhead,No, , ,Equipment/ Facility Failure,Splice/Clamp/Connector,N.A.,N.A.,Unknown,,,,2014-10-01 00:15:00,20.5,20.5
191,191,10/4/2014,2014,10,4,12:16:09 AM,0,16,37.945094,-121.967615,Vegetation,Urban,< 3 meters ,Fire Agency,Contra Costa FD,100468587,AT&T,0 – 750,Conductor,Overhead,No, , ,Wire-Wire Contact,N.A.,N.A.,N.A.,Unknown,,,,2014-10-04 00:16:00,13.0,14.8
192,192,10/4/2014,2014,10,4,12:17:00 AM,0,17,39.9606967,-122.148385,Vegetation,Rural,< 0.25 Acres,Fire Agency,Cal Fire,"SS/ ORANGEWOOD RD; 800' E/O PIEMONT RD, RICHFIELD",,0 – 750,Conductor,Overhead,Yes,10/4/2014 17:00,10/4/2014 17:00,Equipment/ Facility Failure,Transformer,N.A.,N.A.,Unknown,,,,2014-10-04 00:17:00,0.0,7.6
193,193,10/5/2014,2014,10,5,12:10:12 AM,0,10,37.680239,-122.47066399999999,Vegetation,Urban,< 0.25 Acres,Fire Agency,Daly City FD,Capactitor C821,,0 – 750,Capacitor Bank,Overhead,No, , ,Equipment/ Facility Failure,Capacitor Bank,N.A.,N.A.,Unknown,,,,2014-10-05 00:10:00,25.9,25.9
194,194,10/5/2014,2014,10,5,12:22:32 AM,0,22,37.122485,-121.99943600000002,Vegetation,Rural,.26 - 9.99 Acres,Unknown,,100519255,Verizon,21000,Conductor,Overhead,Yes,10/5/2014 22:32,10/5/2014 22:32,Contact From Object,N.A.,Vegetation,Electric Facility,Unknown,,,,2014-10-05 00:22:00,20.5,20.5
195,195,10/6/2014,2014,10,6,12:08:53 AM,0,8,38.89258,-122.73766,Vegetation,Rural,< 0.25 Acres,Fire Agency,Cal Fire,2 SPANS PAST FUSES 2309,,12000,Conductor,Overhead,Yes,10/6/2014 8:53,10/6/2014 8:53,Contact From Object,N.A.,Vegetation,Electric Facility,Unknown,,,,2014-10-06 00:08:00,11.2,11.2
196,196,10/7/2014,2014,10,7,12:11:35 AM,0,11,35.072023,-120.590516,Vegetation,Rural,< 0.25 Acres,Fire Agency,SLO FD,at Fuse 8047, ,12000,Conductor,Subsurface,Yes,10/7/2014 11:35,10/7/2014 11:35,Contact From Object,N.A.,Other,Electric Facility,Human Error,Third-party dig-in,,,2014-10-07 00:11:00,13.0,22.3
197,197,10/8/2014,2014,10,8,12:14:21 AM,0,14,34.645516,-120.411833,Vegetation,Rural,< 3 meters ,Fire Agency,Santa Barbara FD,MTR #1008628785 ,,12000,Conductor,Overhead,No, , ,Equipment/ Facility Failure,Splice/Clamp/Connector,N.A.,N.A.,Unknown,,,,2014-10-08 00:14:00,13.0,14.8
199,199,10/9/2014,2014,10,9,12:19:10 AM,0,19,38.46195,-123.04183,Vegetation,Rural,.26 - 9.99 Acres,Fire Agency,Cal Fire,101955217,AT&T,12000,Conductor,Overhead,Yes,10/9/2014 19:10,10/9/2014 19:10,Equipment/ Facility Failure,Conductor,N.A.,N.A.,Unknown,,,,2014-10-09 00:19:00,14.8,14.8
200,200,10/10/2014,2014,10,10,12:14:41 AM,0,14,38.172101700000006,-122.6282,Vegetation,Rural,.26 - 9.99 Acres,Fire Agency,Cal Fire,969 SAN ANTONIO RD.,,12000,Conductor,Overhead,Yes,10/10/2014 14:41,10/10/2014 14:41,Contact From Object,N.A.,Vegetation,Electric Facility,Unknown,,,,2014-10-10 00:14:00,5.4,16.6
201,201,10/11/2014,2014,10,11,12:10:19 AM,0,10,39.57652,-121.30538,Vegetation,Rural,.26 - 9.99 Acres,Fire Agency,Butte FD,100373776,AT&T,12000,Conductor,Overhead,Yes,10/11/2014 10:19,10/11/2014 10:19,Contact From Object,N.A.,Animal,Electric Facility,Unknown,,,,2014-10-11 00:10:00,13.0,18.4
202,202,10/12/2014,2014,10,12,12:10:59 AM,0,10,38.591725,-121.5387,Vegetation,Rural,Structure Only ,Fire Agency,,1535 HOBSON AVE,,0 – 750,Conductor,Overhead,Yes,10/12/2014 10:59,10/12/2014 10:59,Wire-Wire Contact,N.A.,N.A.,N.A.,Unknown,roof burned,,,2014-10-12 00:10:00,7.6,7.6
203,203,10/12/2014,2014,10,12,12:12:02 AM,0,12,38.5902667,-121.53491170000001,Vegetation,Rural,< 0.25 Acres,Fire Agency,West Sacramento FD,101608435,AT&T,0 – 750,Conductor,Overhead,Yes,10/12/2014 12:02,10/12/2014 12:02,Contact From Object,N.A.,Vegetation,Electric Facility,Unknown,,,,2014-10-12 00:12:00,7.6,7.6
204,204,10/12/2014,2014,10,12,12:16:53 AM,0,16,38.28654829999999,-122.48046670000001,Vegetation,Rural,< 0.25 Acres,Fire Agency,Sonoma FD,APPROX  5 SPAN LOAD SIDE 3635,,0 – 750,Conductor,Overhead,No, , ,Contact From Object,N.A.,Vegetation,Electric Facility,Unknown,,,,2014-10-12 00:16:00,14.8,18.4
205,205,10/13/2014,2014,10,13,12:09:19 AM,0,9,38.183805,-121.854605,Vegetation,Rural,< 0.25 Acres,Fire Agency,,3 POLES E/OF 10313,,21000,Conductor,Overhead,Yes,10/13/2014 9:19,10/13/2014 9:19,Equipment/ Facility Failure,Splice/Clamp/Connector,N.A.,N.A.,Unknown,,,,2014-10-13 00:09:00,22.3,31.7
206,206,10/14/2014,2014,10,14,12:07:33 AM,0,7,36.2506133,-119.86158,Vegetation,Rural,.26 - 9.99 Acres,Fire Agency,Kings County FD,MURPHY RANCH RD E/O AVENAL CUTOFF RD,,12000,Conductor,Overhead,Yes,10/14/2014 7:33,10/14/2014 7:33,Vandalism/Theft,N.A.,N.A.,N.A.,Human Error,gun-shot ,,,2014-10-14 00:07:00,14.8,18.4
207,207,10/14/2014,2014,10,14,12:11:04 AM,0,11,37.901340999999995,-121.76466,Vegetation,Rural,.26 - 9.99 Acres,Fire Agency,Contra Costa FD,3/P/S/0 C/O 13559,,21000,Transformer,Overhead,No, , ,Equipment/ Facility Failure,Conductor,N.A.,N.A.,Unknown,,,,2014-10-14 00:11:00,25.9,25.9
208,208,10/14/2014,2014,10,14,12:14:32 AM,0,14,39.589825,-122.193854,Vegetation,Rural,< 0.25 Acres,Fire Agency,Cal Fire,100425132,,21000,Conductor,Overhead,Yes,10/14/2014 14:32,10/14/2014 14:32,Contact From Object,N.A.,Vegetation,Electric Facility,Human Error,Third-party caused,,,2014-10-14 00:14:00,22.3,22.3
209,209,10/16/2014,2014,10,16,12:16:25 AM,0,16,39.054162,-121.423553,Vegetation,Rural,.26 - 9.99 Acres,Fire Agency,WHEATLAND FIRE,101303519,AT&T,12000,Conductor,Overhead,Yes,10/16/2014 16:25,10/16/2014 16:25,Equipment/ Facility Failure,Conductor,N.A.,N.A.,Unknown,,,,2014-10-16 00:16:00,9.4,20.5
210,210,10/17/2014,2014,10,17,12:13:41 AM,0,13,40.016344000000004,-122.225214,Vegetation,Rural,< 0.25 Acres,Unknown,,Pole BA 28/299,AT&T,60000,Conductor,Overhead,Yes,10/17/2014 13:41,10/17/2014 13:41,Contact From Object,N.A.,Animal,Electric Facility,Unknown,,,,2014-10-17 00:13:00,11.2,18.4
211,211,10/20/2014,2014,10,20,12:01:23 AM,0,1,38.0271917,-121.941965,Vegetation,Urban,< 3 meters ,Fire Agency,CONTRA COSTA,100450134,AT&T,0 – 750,Conductor,Overhead,No, , ,Contact From Object,N.A.,Vegetation,Electric Facility,Unknown,,,,2014-10-20 00:01:00,20.5,20.5
212,212,10/20/2014,2014,10,20,12:13:30 AM,0,13,38.7825333,-122.69262830000001,Vegetation,Rural,.26 - 9.99 Acres,Fire Agency,Cal Fire,3 SPANS SOURCESIDE OF MTR#1008647890,,12000,Conductor,Overhead,Yes,10/20/2014 13:30,10/20/2014 13:30,Contact From Object,N.A.,Vegetation,Electric Facility,Unknown,,,,2014-10-20 00:13:00,14.8,14.8
213,213,10/21/2014,2014,10,21,12:02:54 AM,0,2,37.396428,-121.839597,Vegetation,Rural,< 3 meters ,Fire Agency,SJFIR,3 SP W/O 2089,,12000,Conductor,Overhead,Yes,10/21/2014 2:54,10/21/2014 2:54,Contact From Object,N.A.,Vegetation,Electric Facility,Unknown,,,,2014-10-21 00:02:00,18.4,18.4
214,214,10/22/2014,2014,10,22,12:16:45 AM,0,16,38.379158000000004,-120.50073,Vegetation,Rural,< 0.25 Acres,Fire Agency,West Point Fire,101251221,,0 – 750,Conductor,Overhead,No, , ,Wire-Wire Contact,N.A.,N.A.,N.A.,Unknown,,,,2014-10-22 00:16:00,no data,18.4
215,215,10/22/2014,2014,10,22,12:20:51 AM,0,20,39.006774,-120.74372,Vegetation,Rural,< 0.25 Acres,Fire Agency,Cal Fire,Sw 49,None,60000,Switch,Overhead,Yes,10/22/2014 20:51,10/22/2014 20:51,Equipment/ Facility Failure,Switch,N.A.,N.A.,Unknown,,,,2014-10-22 00:20:00,0.0,13.0
216,216,10/23/2014,2014,10,23,12:12:45 AM,0,12,35.421820000000004,-119.02788999999999,Vegetation,Urban,< 3 meters ,Fire Agency,KERN COUNTY FD,100143992,AT&T,12000,Conductor,Overhead,Yes,10/23/2014 12:45,10/23/2014 12:45,Contact From Object,N.A.,Vegetation,Electric Facility,Unknown,,,,2014-10-23 00:12:00,9.4,13.0
217,217,10/25/2014,2014,10,25,12:03:04 AM,0,3,40.29567,-123.8269867,Vegetation,Rural,< 3 meters ,Fire Agency,Cal Fire,2374 ELK CRK MTR#1008024164,,12000,Conductor,Overhead,Yes,10/25/2014 3:04,10/25/2014 3:04,Contact From Object,N.A.,Vegetation,Electric Facility,Unknown,,,,2014-10-25 00:03:00,35.3,38.9
218,218,10/25/2014,2014,10,25,12:10:52 AM,0,10,38.37811999,-120.5116,Vegetation,Rural,< 3 meters ,Fire Agency,West Point Fire,101249034,,0 – 750,Unknown,Overhead,No, , ,Equipment/ Facility Failure,Insulator,N.A.,N.A.,Unknown,,,,2014-10-25 00:10:00,no data,38.9
219,219,10/25/2014,2014,10,25,12:14:35 AM,0,14,37.0557667,-121.0560933,Vegetation,Rural,.26 - 9.99 Acres,Fire Agency,Cal Fire,1 POLE N/OF MTR #1009070700.,,12000,Conductor,Overhead,Yes,10/25/2014 14:35,10/25/2014 14:35,Equipment/ Facility Failure,Other,N.A.,N.A.,Unknown,,,,2014-10-25 00:14:00,33.5,37.1
220,220,10/25/2014,2014,10,25,12:14:45 AM,0,14,36.55751,-121.927949,Vegetation,Urban,< 3 meters ,Fire Agency,city fire dept,101739963,AT&T,0 – 750,Conductor,Overhead,Yes,10/25/2014 14:45,10/25/2014 14:45,Equipment/ Facility Failure,Crossarm,N.A.,N.A.,Unknown,,,,2014-10-25 00:14:00,no data,37.1
221,221,10/26/2014,2014,10,26,12:22:24 AM,0,22,34.53516,-120.296617,Vegetation,Rural,< 3 meters ,Fire Agency,Santa Barbara CO,@ MTR #1008719129,,12000,Conductor,Overhead,Yes,10/26/2014 22:24,10/26/2014 22:24,Contact From Object,N.A.,Vegetation,Electric Facility,Unknown,,,,2014-10-26 00:22:00,14.8,24.1
222,222,10/27/2014,2014,10,27,12:06:34 AM,0,6,34.8659867,-120.3783817,Vegetation,Rural,< 3 meters ,Fire Agency,Santa Barbara CO,101872138,Verizon,12000,Conductor,Overhead,No, , ,Equipment/ Facility Failure,Conductor,N.A.,N.A.,Unknown,,,,2014-10-27 00:06:00,31.7,40.7
223,223,10/28/2014,2014,10,28,12:12:01 AM,0,12,38.81685,-122.56607,Vegetation,Rural,< 3 meters ,Fire Agency,Cal Fire,102208452,AT&T,12000,Conductor,Overhead,Yes,10/28/2014 12:01,10/28/2014 12:01,Contact From Object,N.A.,Vegetation,Electric Facility,Unknown,,,,2014-10-28 00:12:00,0.0,9.4
224,224,10/28/2014,2014,10,28,12:16:34 AM,0,16,38.21425,-122.25771670000002,Vegetation,Rural,< 0.25 Acres,Fire Agency,American Cyn Fire / CAL Fire,102290370,AT&T,12000,Conductor,Overhead,No, , ,Contact From Object,N.A.,Animal,Electric Facility,Unknown,,,,2014-10-28 00:16:00,16.6,16.6
225,225,10/29/2014,2014,10,29,12:13:22 AM,0,13,39.480295,-122.24927,Vegetation,Rural,< 3 meters ,Fire Agency,WILLOWS FIRE DEPT,RISER POLE LOAD SIDE OF STEP UP BANK 62006,,21000,Lightning Arrestor,Overhead,Yes,10/29/2014 13:22,10/29/2014 13:22,Equipment/ Facility Failure,Lightning Arrestor,N.A.,N.A.,Unknown,,,,2014-10-29 00:13:00,0.0,0.0
226,226,11/1/2014,2014,11,1,12:09:10 AM,0,9,37.185932,-122.001203,Vegetation,Rural,< 3 meters ,Fire Agency,Cal Fire/ Santa Clara County Fire,100551454,Verizon,12000,Conductor,Overhead,Yes,11/1/2014 9:10,11/1/2014 9:10,Contact From Object,N.A.,Vegetation,Electric Facility,Unknown,,,,2014-11-01 00:09:00,0.0,24.1
227,227,11/1/2014,2014,11,1,12:20:52 AM,0,20,41.134383,-124.15211000000001,Vegetation,Rural,< 3 meters ,Fire Agency,CAL FIRE,100980319, ,12000,Conductor,Overhead,Yes,11/1/2014 20:52,11/1/2014 20:52,Contact From Object,N.A.,Vegetation,Electric Facility,Unknown,,,,2014-11-01 00:20:00,14.8,14.8
228,228,11/5/2014,2014,11,5,12:08:34 AM,0,8,38.444471,-122.249299,Vegetation,Rural,< 3 meters ,Fire Agency,Cal Fire,102291451,AT&T,12000,Conductor,Overhead,Yes,11/5/2014 8:34,11/5/2014 8:34,Contact From Object,N.A.,Vegetation,Electric Facility,Unknown,,,,2014-11-05 00:08:00,7.6,13.0
229,229,11/6/2014,2014,11,6,12:10:42 AM,0,10,36.98111,-120.026498,Vegetation,Rural,< 0.25 Acres,Fire Agency,Cal Fire,15882 WATSON RD MADERA, ,12000,Conductor,Overhead,Yes,11/6/2014 10:42,11/6/2014 10:42,Equipment/ Facility Failure,Pole,N.A.,N.A.,Unknown,,,,2014-11-06 00:10:00,5.4,9.4
230,230,11/6/2014,2014,11,6,12:14:56 AM,0,14,37.056745,-120.814975,Vegetation,Rural,< 3 meters ,Self Extinguished,,101201387,AT&T,0 – 750,Conductor,Overhead,No, , ,Contact From Object,N.A.,Vegetation,Electric Facility,Unknown,,,,2014-11-06 00:14:00,7.6,9.4
231,231,11/7/2014,2014,11,7,12:06:12 AM,0,6,35.31694999,-120.67960900000001,Vegetation,Urban,< 3 meters ,Fire Agency,Cal Fire,FUSE 11065, ,12000,Conductor,Overhead,Yes,11/7/2014 6:12,11/7/2014 6:12,Wire-Wire Contact,N.A.,N.A.,N.A.,Unknown,,,,2014-11-07 00:06:00,20.5,25.9
232,232,11/8/2014,2014,11,8,12:15:02 AM,0,15,38.182087,-122.669294,Vegetation,Rural,< 3 meters ,Customer,,5450 RED HILL RD, ,0 – 750,Conductor,Overhead,No, , ,Equipment/ Facility Failure,Splice/Clamp/Connector,N.A.,N.A.,Unknown,,,,2014-11-08 00:15:00,14.8,16.6
233,233,11/9/2014,2014,11,9,12:06:34 AM,0,6,37.941918,-122.375504,Vegetation,Rural,< 3 meters ,Fire Agency,RICHMOND PD,101443361,AT&T,12000,Conductor,Overhead,Yes,11/9/2014 6:34,11/9/2014 6:34,Equipment/ Facility Failure,Conductor,N.A.,N.A.,Unknown,,,,2014-11-09 00:06:00,7.6,11.2
234,234,11/14/2014,2014,11,14,12:12:37 AM,0,12,37.65104999,-122.45408,Vegetation,Urban,< 3 meters ,Fire Agency,PACIFICA FD,ON #4 LINE SIDE OF 11949 & 6053, ,12000,Conductor,Overhead,Yes,11/14/2014 12:37,11/14/2014 12:37,Contact From Object,N.A.,Vehicle,Electric Facility,Human Error,,,,2014-11-14 00:12:00,13.0,16.6
235,235,11/16/2014,2014,11,16,12:05:29 AM,0,5,37.530506700000004,-122.5165317,Vegetation,Rural,< 3 meters ,Fire Agency,Cal Fire,2166 Vallemar  Moss beach, ,12000,Conductor,Overhead,Yes,11/16/2014 5:29,11/16/2014 5:29,Contact From Object,N.A.,Vegetation,Electric Facility,Unknown,,,,2014-11-16 00:05:00,14.8,22.3
236,236,11/16/2014,2014,11,16,12:17:55 AM,0,17,37.511832,-121.971801,Vegetation,Urban,< 0.25 Acres,Fire Agency,FREMONT FIRE DEPT,IRO 42979 EVERGLADES PARK DR, ,0 – 750,Conductor,Overhead,No, , ,Contact From Object,N.A.,Other,Electric Facility,Human Error,Soccer ball?,,,2014-11-16 00:17:00,14.8,20.5
237,237,11/17/2014,2014,11,17,12:17:15 AM,0,17,38.04444,-122.86065,Vegetation,Rural,.26 - 9.99 Acres,Fire Agency,marin county fire,1 SPAN LD SIDE OF FUCO 6803, ,12000,Conductor,Overhead,Yes,11/17/2014 17:15,11/17/2014 17:15,Equipment/ Facility Failure,Crossarm,N.A.,N.A.,Unknown,,,,2014-11-17 00:17:00,7.6,11.2
238,238,11/18/2014,2014,11,18,12:14:16 AM,0,14,37.035305,-122.086565,Vegetation,Rural,< 0.25 Acres,Fire Agency,Felton Fire Dept.,101798988, ,21000,Conductor,Overhead,Yes,11/18/2014 14:16,11/18/2014 14:16,Contact From Object,N.A.,Vegetation,Electric Facility,Unknown,,,,2014-11-18 00:14:00,5.4,13.0
239,239,11/22/2014,2014,11,22,12:06:29 AM,0,6,36.747234000000006,-119.785909,Vegetation,Urban,< 3 meters ,Fire Agency,FRESNO CITY FIRE,MTR# 1008712302, ,12000,Conductor,Overhead,Yes,11/22/2014 6:29,11/22/2014 6:29,Equipment/ Facility Failure,Splice/Clamp/Connector,N.A.,N.A.,Unknown,,,,2014-11-22 00:06:00,0.0,13.0
240,240,11/23/2014,2014,11,23,12:05:45 AM,0,5,40.162759,-122.238156,Vegetation,Urban,< 3 meters ,Self Extinguished,,MTR #1008299414, ,12000,Conductor,Overhead,Yes,11/23/2014 5:45,11/23/2014 5:45,Equipment/ Facility Failure,Splice/Clamp/Connector,N.A.,N.A.,Unknown,,,,2014-11-23 00:05:00,16.6,16.6
241,241,11/24/2014,2014,11,24,12:15:29 AM,0,15,37.44018,-121.918797,Vegetation,Urban,< 0.25 Acres,Fire Agency,Milpitas Fire Department,back yard of 599 Redwood ave, ,0 – 750,Unknown,Overhead,No, , ,Unknown,N.A.,N.A.,N.A.,Unknown,,,,2014-11-24 00:15:00,13.0,14.8
242,242,11/28/2014,2014,11,28,12:01:17 AM,0,1,37.989241,-122.314608,Vegetation,Urban,< 0.25 Acres,Fire Agency, ,101425748,AT&T,0 – 750,Conductor,Overhead,No, , ,Unknown,N.A.,N.A.,N.A.,Unknown,,,,2014-11-28 00:01:00,no data,14.8
244,244,12/8/2014,2014,12,8,12:09:51 AM,0,9,36.83747999,-119.78998,Vegetation,Urban,< 3 meters ,Self Extinguished,,101780312, ,21000,Conductor,Overhead,Yes,12/8/2014 9:51,12/8/2014 9:51,Contact From Object,N.A.,Animal,Electric Facility,Unknown,,,,2014-12-08 00:09:00,5.4,7.6
245,245,12/8/2014,2014,12,8,12:18:33 AM,0,18,37.463066999999995,-122.260094,Vegetation,Urban,< 0.25 Acres,Fire Agency,REDWOOD CITY FD,100300013,AT&T,12000,Conductor,Overhead,Yes,12/8/2014 18:33,12/8/2014 18:33,Equipment/ Facility Failure,Splice/Clamp/Connector,N.A.,N.A.,Unknown,,,,2014-12-08 00:18:00,5.4,5.4
246,246,12/12/2014,2014,12,12,12:04:07 AM,0,4,36.63785,-121.81246000000002,Vegetation,Rural,< 3 meters ,Utility: PG&E, ,101762582,AT&T,12000,Conductor,Overhead,Yes,12/12/2014 4:07,12/12/2014 4:07,Contact From Object,N.A.,Vegetation,Electric Facility,Unknown,,,,2014-12-12 00:04:00,no data,5.4
247,247,12/12/2014,2014,12,12,12:22:15 AM,0,22,37.391795,-122.2670467,Vegetation,Rural,< 3 meters ,Unknown,,IFO 75 RANCH RD WOODSIDE, ,12000,Conductor,Overhead,Yes,12/12/2014 22:15,12/12/2014 22:15,Contact From Object,N.A.,Vegetation,Electric Facility,Unknown,,,,2014-12-12 00:22:00,11.2,11.2
249,249,12/19/2014,2014,12,19,12:13:50 AM,0,13,37.460978999999995,-122.17686100000002,Vegetation,Urban,< 3 meters ,Fire Agency,MENLO PARK,100298576,AT&T,12000,Conductor,Overhead,Yes,12/19/2014 13:50,12/19/2014 13:50,Equipment/ Facility Failure,Conductor,N.A.,N.A.,Unknown,,,,2014-12-19 00:13:00,11.2,11.2
250,250,12/25/2014,2014,12,25,12:10:50 AM,0,10,36.383716,-121.8663,Vegetation,Rural,< 3 meters ,Fire Agency,Mid Valley FD ?,101669474,AT&T,12000,Conductor,Overhead,Yes,12/25/2014 10:50,12/25/2014 10:50,Contact From Object,N.A.,Vegetation,Electric Facility,Unknown,,,,2014-12-25 00:10:00,no data,11.2
252,252,12/30/2014,2014,12,30,12:09:00 AM,0,9,38.40586,-120.51532399999999,Vegetation,Rural,< 0.25 Acres,Fire Agency,Cal Fire,674 SMITTY LN,  ,12000,Conductor,Overhead,Yes,12/30/2014 9:00,12/30/2014 9:00,Contact From Object,N.A.,Vegetation,Electric Facility,Unknown,,,,2014-12-30 00:09:00,no data,11.2
255,1,1/10/2015,2015,1,10,12:13:07 AM,0,13,38.089032,-122.208693,Vegetation,Urban,< 0.25 Acres,Utility: PG&E,,102217759,,12000,Conductor,Overhead,Yes,1/10/2015 13:07,1/10/2015 13:07,Contact From Object,N.A.,Animal,Electric Facility,Unknown,,,,2015-01-10 00:13:00,5.4,9.4
256,2,1/16/2015,2015,1,16,12:07:07 AM,0,7,38.775327000000004,-122.700442,Vegetation,Rural,< 3 meters ,Fire Agency,CAL FIRE,102167494,Pacific Bell,0 – 750,Conductor,Overhead,No, , ,Unknown,N.A.,N.A.,N.A.,Unknown,,,,2015-01-16 00:07:00,0.0,0.0
257,3,1/26/2015,2015,1,26,12:03:51 AM,0,3,37.053940000000004,-122.15867,Vegetation,Rural,< 0.25 Acres,Fire Agency,CAL FIRE,,,12000,Conductor,Overhead,Yes,1/26/2015 3:51,1/26/2015 3:51,Contact From Object,N.A.,Vegetation,Electric Facility,Unknown,,,,2015-01-26 00:03:00,7.6,9.4
258,4,2/6/2015,2015,2,6,12:06:01 AM,0,6,38.60589,-121.02213,Vegetation,Rural,< 3 meters ,Fire Agency,,"6661 Ryan Ranch Road, El Dorado Hills",,21000,Conductor,Overhead,Yes,2/6/2015 6:01,2/6/2015 6:01,Contact From Object,N.A.,Vegetation,Electric Facility,Unknown,,,,2015-02-06 00:06:00,18.4,31.7
259,5,2/6/2015,2015,2,6,12:14:08 AM,0,14,36.403209999999994,-121.91088,Vegetation,Rural,.26 - 9.99 Acres,Fire Agency,CAL FIRE,loadside of 40283,,12000,Conductor,Overhead,Yes,2/6/2015 14:08,2/6/2015 14:08,Contact From Object,N.A.,Vegetation,Electric Facility,Unknown,,,,2015-02-06 00:14:00,no data,31.7
260,6,2/7/2015,2015,2,7,12:15:13 AM,0,15,38.08711999,-122.54962900000001,Vegetation,Rural,.26 - 9.99 Acres,Fire Agency,NOVATO FIRE DEPARTMENT,103598139,,12000,Conductor,Overhead,Yes,2/7/2015 15:13,2/7/2015 15:13,Equipment/ Facility Failure,Pole,N.A.,N.A.,Unknown,,,,2015-02-07 00:15:00,46.4,46.4
261,7,2/7/2015,2015,2,7,12:18:38 AM,0,18,40.46741,-123.65446000000001,Vegetation,Rural,< 0.25 Acres,Fire Agency,CAL FIRE,"mile marker 36.61, hwy 36, bridgeville",,12000,Conductor,Overhead,Yes,2/7/2015 18:38,2/7/2015 18:38,Contact From Object,N.A.,Vegetation,Electric Facility,Unknown,,,,2015-02-07 00:18:00,31.7,31.7
262,8,2/13/2015,2015,2,13,12:16:01 AM,0,16,35.362843,-118.966149,Vegetation,Urban,< 0.25 Acres,Fire Agency,Bakersfield FD,"512 Wilma Street, Bakersfield",,0 – 750,Conductor,Overhead,Yes,2/13/2015 16:01,2/13/2015 16:01,Contact From Object,N.A.,Vegetation,Electric Facility,Human Error,Third-party caused,,,2015-02-13 00:16:00,11.2,13.0
263,9,2/16/2015,2015,2,16,12:11:08 AM,0,11,37.35996,-120.852329,Vegetation,Rural,< 0.25 Acres,Fire Agency,CAL FIRE,101206051,,12000,Conductor,Overhead,Yes,2/16/2015 11:08,2/16/2015 11:08,Contact From Object,N.A.,Vehicle,Pole,Human Error,,,,2015-02-16 00:11:00,no data,13.0
264,10,2/17/2015,2015,2,17,12:16:46 AM,0,16,39.762834999999995,-121.582683,Vegetation,Urban,< 3 meters ,Fire Agency,butte county,100324934,Pacific Bell,12000,Conductor,Overhead,Yes,2/17/2015 16:46,2/17/2015 16:46,Contact From Object,N.A.,Vegetation,Electric Facility,Human Error,Third-party caused,,,2015-02-17 00:16:00,9.4,14.8
265,11,2/22/2015,2015,2,22,12:14:20 AM,0,14,38.816,-122.1831767,Vegetation,Rural,.26 - 9.99 Acres,Fire Agency,Capay,101592201,,21000,Conductor,Overhead,Yes,2/22/2015 14:20,2/22/2015 14:20,Contact From Object,N.A.,Vehicle,Pole,Human Error,,,,2015-02-22 00:14:00,9.4,9.4
266,12,2/23/2015,2015,2,23,12:02:05 AM,0,2,39.302734,-121.01749,Vegetation,Rural,< 3 meters ,Fire Agency,NEVADA CITY FIRE,100086316,,12000,Conductor,Overhead,Yes,2/23/2015 2:05,2/23/2015 2:05,Contact From Object,N.A.,Vegetation,Electric Facility,Unknown,,,,2015-02-23 00:02:00,20.5,29.5
267,13,2/23/2015,2015,2,23,12:13:25 AM,0,13,38.50455,-122.74081000000001,Vegetation,Rural,< 0.25 Acres,Fire Agency,RINCON VALLEY,BEHIND 4870 CARRIAGE LN SANTA ROSA,,12000,Conductor,Overhead,Yes,2/23/2015 13:25,2/23/2015 13:25,Contact From Object,N.A.,Vegetation,Electric Facility,Unknown,,,,2015-02-23 00:13:00,22.3,35.3
268,14,2/25/2015,2015,2,25,12:02:34 AM,0,2,36.75618,-119.78001,Vegetation,Urban,< 3 meters ,Fire Agency,CITY OF FRESNO,100869017,Pacific Bell,12000,Fuse,Overhead,Yes,2/25/2015 2:34,2/25/2015 2:34,Equipment/ Facility Failure,Fuse,N.A.,N.A.,Unknown,,,,2015-02-25 00:02:00,5.4,9.4
269,15,2/25/2015,2015,2,25,12:16:42 AM,0,16,34.89209999,-120.503969,Vegetation,Rural,< 3 meters ,Customer,,,,0 – 750,Conductor,Overhead,Yes,2/25/2015 16:42,2/25/2015 16:42,Equipment/ Facility Failure,Splice/Clamp/Connector,N.A.,N.A.,Unknown,,,,2015-02-25 00:16:00,29.5,29.5
270,16,3/4/2015,2015,3,4,12:18:44 AM,0,18,38.99945,-122.75451000000001,Vegetation,Rural,< 0.25 Acres,Fire Agency,Kelseyville FD,102156367,Pacific Bell,12000,Conductor,Overhead,Yes,3/4/2015 18:44,3/4/2015 18:44,Equipment/ Facility Failure,Conductor,N.A.,N.A.,Unknown,,,,2015-03-04 00:18:00,5.4,9.4
271,17,3/7/2015,2015,3,7,12:13:35 AM,0,13,38.70909,-122.64837,Vegetation,Rural,< 0.25 Acres,Fire Agency,CAL FIRE,"14417 western mine rd, Middletown",,12000,Conductor,Overhead,Yes,3/7/2015 13:35,3/7/2015 13:35,Contact From Object,N.A.,Vegetation,Electric Facility,Unknown,,,,2015-03-07 00:13:00,9.4,11.2
273,19,3/14/2015,2015,3,14,12:02:30 AM,0,2,38.90381,-122.7579,Vegetation,Rural,< 0.25 Acres,Unknown,,"9210 Wildcat Road, Kelseyville",,12000,Conductor,Overhead,Yes,3/14/2015 2:30,3/14/2015 2:30,Contact From Object,N.A.,Vegetation,Electric Facility,Unknown,,,,2015-03-14 00:02:00,13.0,13.0
274,20,3/14/2015,2015,3,14,12:14:17 AM,0,14,38.8252517,-121.1363233,Vegetation,Rural,< 3 meters ,Fire Agency,LOOMIS FIRE,100051369,Pacific Bell,0 – 750,Conductor,Overhead,No, , ,Contact From Object,N.A.,Balloons,Electric Facility,Human Error,,,,2015-03-14 00:14:00,7.6,7.6
275,21,3/14/2015,2015,3,14,12:22:09 AM,0,22,36.89154,-121.71191,Vegetation,Rural,< 0.25 Acres,Fire Agency,CAL FIRE,103525395,,21000,Conductor,Overhead,Yes,3/14/2015 22:09,3/14/2015 22:09,Contact From Object,N.A.,Vegetation,Electric Facility,Unknown,,,,2015-03-14 00:22:00,9.4,9.4
276,22,3/15/2015,2015,3,15,12:03:26 AM,0,3,35.369325,-118.92803500000001,Vegetation,Urban,< 0.25 Acres,Fire Agency,KERN COUNTY FIRE DEPT,100216241,Pacific Bell,0 – 750,Unknown,Overhead,No, , ,Unknown,N.A.,N.A.,N.A.,Unknown,,,,2015-03-15 00:03:00,9.4,9.4
277,23,3/15/2015,2015,3,15,12:03:38 AM,0,3,36.93396,-119.78021499999998,Vegetation,Rural,< 3 meters ,Unknown,,101121519,None,21000,Conductor,Overhead,Yes,3/15/2015 3:38,3/15/2015 3:38,Equipment/ Facility Failure,Pole,N.A.,N.A.,Unknown,,,,2015-03-15 00:03:00,14.8,14.8
278,24,3/15/2015,2015,3,15,12:22:47 AM,0,22,38.33456999,-120.532529,Vegetation,Rural,< 3 meters ,Fire Agency,CAL FIRE,103106530,,12000,Conductor,Overhead,Yes,3/15/2015 22:47,3/15/2015 22:47,Contact From Object,N.A.,Vehicle,Pole,Human Error,,,,2015-03-15 00:22:00,no data,14.8
279,25,3/19/2015,2015,3,19,12:20:11 AM,0,20,37.84163,-122.12176000000001,Vegetation,Urban,< 3 meters ,Fire Agency,moraga fire,100498544,Pacific Bell,12000,Conductor,Overhead,Yes,3/19/2015 20:11,3/19/2015 20:11,Equipment/ Facility Failure,Conductor,N.A.,N.A.,Unknown,,,,2015-03-19 00:20:00,22.3,22.3
280,26,3/21/2015,2015,3,21,12:10:46 AM,0,10,40.16447999,-122.28938899999999,Vegetation,Rural,< 3 meters ,Fire Agency,CAL FIRE,101546309,Pacific Bell,12000,Conductor,Overhead,Yes,3/21/2015 10:46,3/21/2015 10:46,Contact From Object,N.A.,Vehicle,Pole,Human Error,,,,2015-03-21 00:10:00,14.8,18.4
281,27,3/21/2015,2015,3,21,12:11:03 AM,0,11,36.56658,-121.51428,Vegetation,Rural,< 0.25 Acres,Fire Agency,Monterey Regonal,101758338,Pacific Bell,12000,Conductor,Overhead,Yes,3/21/2015 11:03,3/21/2015 11:03,Equipment/ Facility Failure,Splice/Clamp/Connector,N.A.,N.A.,Unknown,,,,2015-03-21 00:11:00,no data,18.4
282,28,3/31/2015,2015,3,31,12:13:33 AM,0,13,37.11247,-120.94326000000001,Vegetation,Rural,< 3 meters ,Fire Agency,COUNTY FIRE,101199839,,0 – 750,Conductor,Overhead,Yes,3/31/2015 13:33,3/31/2015 13:33,Contact From Object,N.A.,Animal,Electric Facility,Unknown,,,,2015-03-31 00:13:00,11.2,13.0
283,29,4/2/2015,2015,4,2,12:09:44 AM,0,9,39.67721999,-121.491979,Vegetation,Rural,< 0.25 Acres,Fire Agency,CAL FIRE,100338726,,12000,Conductor,Overhead,Yes,4/2/2015 9:44,4/2/2015 9:44,Equipment/ Facility Failure,Splice/Clamp/Connector,N.A.,N.A.,Unknown,,,,2015-04-02 00:09:00,no data,13.0
284,30,4/4/2015,2015,4,4,12:16:49 AM,0,16,38.88244999,-122.59135,Vegetation,Rural,< 0.25 Acres,Fire Agency,CAL FIRE,"20748 Jerusalem Grade Road, Middletown",,12000,Other,Overhead,Yes,4/4/2015 16:49,4/4/2015 16:49,Equipment/ Facility Failure,Other,N.A.,N.A.,Unknown,Booster,,,2015-04-04 00:16:00,11.2,14.8
285,31,4/11/2015,2015,4,11,12:17:16 AM,0,17,40.5461873,-122.23426609999999,Vegetation,Rural,< 0.25 Acres,Unknown,,101491414,,12000,Conductor,Overhead,Yes,4/11/2015 17:16,4/11/2015 17:16,Contact From Object,N.A.,Vegetation,Electric Facility,Unknown,,,,2015-04-11 00:17:00,13.0,20.5
286,32,4/12/2015,2015,4,12,12:12:35 AM,0,12,40.18609,-122.213849,Vegetation,Rural,< 0.25 Acres,Fire Agency,NOT SURE 2ND ON SITE (1ST LXMX),101544984,,12000,Conductor,Overhead,Yes,4/12/2015 12:35,4/12/2015 12:35,Contact From Object,N.A.,Vegetation,Electric Facility,Unknown,,,,2015-04-12 00:12:00,5.4,14.8
287,33,4/14/2015,2015,4,14,12:11:09 AM,0,11,38.02150999,-121.60998899999998,Vegetation,Rural,< 3 meters ,Fire Agency,EAST CONTRA COSTA,100505773,Pacific Bell,0 – 750,Conductor,Overhead,Yes,4/14/2015 11:09,4/14/2015 11:09,Equipment/ Facility Failure,Splice/Clamp/Connector,N.A.,N.A.,Unknown,,,,2015-04-14 00:11:00,40.7,40.7
288,34,4/14/2015,2015,4,14,12:12:35 AM,0,12,38.178909999999995,-121.6938433,Vegetation,Rural,< 0.25 Acres,Fire Agency,CAL FIRE,AIRPORT RD BTW 2CD & 3RD P/S/O CHURCH RD,,21000,Conductor,Overhead,Yes,4/14/2015 12:35,4/14/2015 12:35,Contact From Object,N.A.,Animal,Electric Facility,Unknown,,,,2015-04-14 00:12:00,38.9,40.7
289,35,4/15/2015,2015,4,15,12:12:35 AM,0,12,39.11522670000001,-121.5710967,Vegetation,Urban,< 3 meters ,Unknown,,101319105,Pacific Bell,0 – 750,Conductor,Overhead,Yes,4/15/2015 12:35,4/15/2015 12:35,Equipment/ Facility Failure,Crossarm,N.A.,N.A.,Unknown,,,,2015-04-15 00:12:00,20.5,24.1
290,36,4/16/2015,2015,4,16,12:17:35 AM,0,17,38.20541,-122.147549,Vegetation,Rural,< 3 meters ,Fire Agency,FAIRFIELD FD,SB 17513,,12000,Conductor,Overhead,Yes,4/16/2015 17:35,4/16/2015 17:35,Equipment/ Facility Failure,Conductor,N.A.,N.A.,Unknown,,,,2015-04-16 00:17:00,16.6,20.5
291,37,4/17/2015,2015,4,17,12:14:34 AM,0,14,37.004131,-119.72926499999998,Vegetation,Rural,.26 - 9.99 Acres,Fire Agency,MADERA COUNTY,101118401,,21000,Conductor,Overhead,Yes,4/17/2015 14:34,4/17/2015 14:34,Other,N.A.,N.A.,N.A.,Other,bird nest caught fire,,,2015-04-17 00:14:00,9.4,9.4
292,38,4/18/2015,2015,4,18,12:03:07 AM,0,3,38.68575999,-121.00838999999999,Vegetation,Urban,< 3 meters ,Fire Agency,carmeron park F.D.,around t-7464,,21000,Conductor,Overhead,Yes,4/18/2015 3:07,4/18/2015 3:07,Contact From Object,N.A.,Vehicle,Pole,Human Error,,,,2015-04-18 00:03:00,9.4,14.8
293,39,4/19/2015,2015,4,19,12:09:18 AM,0,9,36.576370000000004,-119.66898,Vegetation,Rural,< 0.25 Acres,Self Extinguished,,100826688,Pacific Bell,12000,Conductor,Overhead,Yes,4/19/2015 9:18,4/19/2015 9:18,Equipment/ Facility Failure,Splice/Clamp/Connector,N.A.,N.A.,Unknown,,,,2015-04-19 00:09:00,9.4,13.0
294,40,4/19/2015,2015,4,19,12:13:01 AM,0,13,37.1571,-120.4145,Vegetation,Rural,< 0.25 Acres,Unknown,,101013878,,12000,Conductor,Overhead,Yes,4/19/2015 13:01,4/19/2015 13:01,Contact From Object,N.A.,Animal,Electric Facility,Unknown,,,,2015-04-19 00:13:00,11.2,11.2
295,41,4/20/2015,2015,4,20,12:18:18 AM,0,18,36.9743083,-120.01757830000001,Vegetation,Rural,.26 - 9.99 Acres,Fire Agency,MFD,101211344,Pacific Bell,12000,Conductor,Overhead,Yes,4/20/2015 18:18,4/20/2015 18:18,Equipment/ Facility Failure,Splice/Clamp/Connector,N.A.,N.A.,Unknown,,,,2015-04-20 00:18:00,13.0,13.0
296,42,4/21/2015,2015,4,21,12:17:01 AM,0,17,34.931259000000004,-120.440481,Vegetation,Urban,< 3 meters ,Self Extinguished,,101919414,Verizon,12000,Conductor,Overhead,Yes,4/21/2015 17:01,4/21/2015 17:01,Equipment/ Facility Failure,Splice/Clamp/Connector,N.A.,N.A.,Unknown,,,,2015-04-21 00:17:00,22.3,25.9
297,43,4/24/2015,2015,4,24,12:06:06 AM,0,6,38.0500667,-121.4966433,Vegetation,Rural,< 3 meters ,Fire Agency,unknown,levee rd s/o herman and helans resort,,21000,Conductor,Overhead,Yes,4/24/2015 6:06,4/24/2015 6:06,Equipment/ Facility Failure,Conductor,N.A.,N.A.,Unknown,,,,2015-04-24 00:06:00,20.5,20.5
298,44,4/24/2015,2015,4,24,12:17:47 AM,0,17,37.55863999,-121.919619,Vegetation,Rural,< 0.25 Acres,Fire Agency,Alameda County,Base of C/O pole 9435,,12000,Unknown,Overhead,Yes,4/24/2015 17:47,4/24/2015 17:47,Unknown,N.A.,N.A.,N.A.,Unknown,,,,2015-04-24 00:17:00,27.7,27.7
299,45,4/26/2015,2015,4,26,12:16:50 AM,0,16,34.8546667,-120.5239933,Vegetation,Rural,.26 - 9.99 Acres,Fire Agency,Santa Barbara County Fire Dept,2 poles load side 7455,None,12000,Conductor,Overhead,Yes,4/26/2015 16:50,4/26/2015 16:50,Equipment/ Facility Failure,Insulator,N.A.,N.A.,Unknown,,,,2015-04-26 00:16:00,31.7,38.9
300,46,4/27/2015,2015,4,27,12:12:54 AM,0,12,35.487094,-120.67561,Vegetation,Rural,< 3 meters ,Unknown,,103310601,,21000,Conductor,Overhead,Yes,4/27/2015 12:54,4/27/2015 12:54,Contact From Object,N.A.,Balloons,Electric Facility,Human Error,,,,2015-04-27 00:12:00,18.4,18.4
301,47,4/28/2015,2015,4,28,12:13:57 AM,0,13,36.7504334,-119.74830940000001,Vegetation,Urban,< 3 meters ,Fire Agency,FRESNO CITY FIRE,100842188,,12000,Conductor,Overhead,Yes,4/28/2015 13:57,4/28/2015 13:57,Equipment/ Facility Failure,Conductor,N.A.,N.A.,Unknown,,,,2015-04-28 00:13:00,11.2,11.2
302,48,4/28/2015,2015,4,28,12:14:20 AM,0,14,39.79716,-121.89074,Vegetation,Rural,< 3 meters ,Unknown,,100435592,Pacific Bell,12000,Conductor,Overhead,Yes,4/28/2015 14:20,4/28/2015 14:20,Equipment/ Facility Failure,Insulator,N.A.,N.A.,Unknown,,,,2015-04-28 00:14:00,27.7,27.7
303,49,4/30/2015,2015,4,30,12:00:26 AM,0,0,37.240140000000004,-122.2472,Vegetation,Rural,< 0.25 Acres,Unknown,,1145 VERDE R,,12000,Conductor,Overhead,Yes,4/30/2015 0:26,4/30/2015 0:26,Contact From Object,N.A.,Vegetation,Electric Facility,Unknown,,,,2015-04-30 00:00:00,22.3,25.9
304,50,5/2/2015,2015,5,2,12:16:51 AM,0,16,37.32843,-119.64296000000002,Vegetation,Rural,< 0.25 Acres,Fire Agency,MADERA COUNTY,103768995,,12000,Conductor,Overhead,Yes,5/2/2015 16:51,5/2/2015 16:51,Equipment/ Facility Failure,Splice/Clamp/Connector,N.A.,N.A.,Unknown,,,,2015-05-02 00:16:00,18.4,18.4
305,51,5/2/2015,2015,5,2,12:17:30 AM,0,17,38.20382,-121.26438,Vegetation,Rural,< 0.25 Acres,Unknown,,103765745,Pacific Bell,12000,Conductor,Overhead,Yes,5/2/2015 17:30,5/2/2015 17:30,Contact From Object,N.A.,Other,Electric Facility,Human Error,Sky diver hit line,,,2015-05-02 00:17:00,22.3,22.3
306,52,5/6/2015,2015,5,6,12:17:17 AM,0,17,37.42727,-119.8802767,Vegetation,Rural,.26 - 9.99 Acres,Fire Agency,CAL FIRE,BOOSTER 8179 INDIAN PEEK N/O MIWUK,None,21000,Other,Overhead,Yes,5/6/2015 17:17,5/6/2015 17:17,Equipment/ Facility Failure,Other,N.A.,N.A.,Unknown,Booster,,,2015-05-06 00:17:00,13.0,14.8
307,53,5/6/2015,2015,5,6,12:23:10 AM,0,23,39.810395,-122.329176,Vegetation,Rural,.26 - 9.99 Acres,Fire Agency,CAL FIRE,BLACK BUTTE,,12000,Lightning Arrestor,Overhead,Yes,5/6/2015 23:10,5/6/2015 23:10,Equipment/ Facility Failure,Lightning Arrestor,N.A.,N.A.,Unknown,,,,2015-05-06 00:23:00,18.4,18.4
308,54,5/7/2015,2015,5,7,12:08:06 AM,0,8,39.237984999999995,-121.58751000000001,Vegetation,Rural,< 0.25 Acres,Unknown,,101331086,,0 – 750,Conductor,Overhead,No, , ,Contact From Object,N.A.,Animal,Electric Facility,Unknown, ,,,2015-05-07 00:08:00,13.0,13.0
309,55,5/8/2015,2015,5,8,12:05:55 AM,0,5,38.77552999,-121.50641999999999,Vegetation,Rural,.26 - 9.99 Acres,Fire Agency,fire dept,mtr # 03650R,,0 – 750,Fuse,Overhead,Yes,5/8/2015 5:55,5/8/2015 5:55,Equipment/ Facility Failure,Fuse,N.A.,N.A.,Unknown,,,,2015-05-08 00:05:00,9.4,13.0
310,56,5/9/2015,2015,5,9,12:13:10 AM,0,13,39.23429,-121.246825,Vegetation,Rural,.26 - 9.99 Acres,Fire Agency,CAL FIRE,100000103,None,21000,Conductor,Overhead,Yes,5/9/2015 13:10,5/9/2015 13:10,Equipment/ Facility Failure,Pole,N.A.,N.A.,Unknown,,,,2015-05-09 00:13:00,0.0,14.8
311,57,5/9/2015,2015,5,9,12:21:37 AM,0,21,39.28477,-121.021919,Vegetation,Rural,< 3 meters ,Fire Agency,CAL FIRE,100004095,Pacific Bell,12000,Fuse,Overhead,Yes,5/9/2015 21:37,5/9/2015 21:37,Equipment/ Facility Failure,Fuse,N.A.,N.A.,Unknown,,,,2015-05-09 00:21:00,0.0,14.8
312,58,5/10/2015,2015,5,10,12:15:03 AM,0,15,37.664943,-122.432181,Vegetation,Urban,< 0.25 Acres,Fire Agency,San Mateo FD,100282481,Pacific Bell,12000,Conductor,Overhead,Yes,5/10/2015 15:03,5/10/2015 15:03,Contact From Object,N.A.,Balloons,Electric Facility,Human Error,,,,2015-05-10 00:15:00,33.5,33.5
313,59,5/10/2015,2015,5,10,12:16:07 AM,0,16,37.783158,-120.79332099999999,Vegetation,Rural,< 0.25 Acres,Fire Agency,Oakdale,9956 Dillwood rd.,,17000,Conductor,Overhead,Yes,5/10/2015 16:07,5/10/2015 16:07,Contact From Object,N.A.,Balloons,Electric Facility,Human Error,,,,2015-05-10 00:16:00,16.6,16.6
314,60,5/11/2015,2015,5,11,12:07:19 AM,0,7,38.123345,-121.37083329999999,Vegetation,Rural,10 - 99 Acres,Fire Agency,woodbridge fd,102075242,Pacific Bell,21000,Conductor,Overhead,Yes,5/11/2015 7:19,5/11/2015 7:19,Equipment/ Facility Failure,Conductor,N.A.,N.A.,Unknown,,,,2015-05-11 00:07:00,20.5,20.5
315,61,5/11/2015,2015,5,11,12:16:07 AM,0,16,35.925344200000005,-120.86691370000001,Vegetation,Rural,< 3 meters ,Unknown,,LR 7064 JUMP,,12000,Conductor,Overhead,Yes,5/11/2015 16:07,5/11/2015 16:07,Equipment/ Facility Failure,Conductor,N.A.,N.A.,Unknown,,,,2015-05-11 00:16:00,16.6,16.6
316,62,5/11/2015,2015,5,11,12:16:18 AM,0,16,39.280448299999996,-123.20673670000001,Vegetation,Rural,< 0.25 Acres,Fire Agency,REDWOOD VALLEY FIRE,"9502 EAST RD., REDWOOD VALLEY",,0 – 750,Conductor,Overhead,Yes,5/11/2015 16:18,5/11/2015 16:18,Contact From Object,N.A.,Vegetation,Electric Facility,Unknown,,,,2015-05-11 00:16:00,20.5,20.5
317,63,5/12/2015,2015,5,12,12:23:57 AM,0,23,39.1851417,-121.6804133,Vegetation,Rural,< 3 meters ,Fire Agency,YUBA CITY,101303383,Pacific Bell,0 – 750,Transformer,Overhead,Yes,5/12/2015 23:57,5/12/2015 23:57,Equipment/ Facility Failure,Transformer,N.A.,N.A.,Unknown,,,,2015-05-12 00:23:00,20.5,25.9
318,64,5/13/2015,2015,5,13,12:21:57 AM,0,21,37.49422,-122.3680333,Vegetation,Rural,< 3 meters ,Fire Agency,sm county cal fire,103492873,,12000,Conductor,Overhead,Yes,5/13/2015 21:57,5/13/2015 21:57,Equipment/ Facility Failure,Conductor,N.A.,N.A.,Unknown,,,,2015-05-13 00:21:00,24.1,35.3
319,65,5/14/2015,2015,5,14,12:11:03 AM,0,11,37.05514,-120.31698999999999,Vegetation,Rural,< 0.25 Acres,Self Extinguished,,S/O 10696 AVE. 19 1/2,,12000,Conductor,Overhead,Yes,5/14/2015 11:03,5/14/2015 11:03,Contact From Object,N.A.,Vehicle,Pole,Human Error,,,,2015-05-14 00:11:00,9.4,14.8
320,66,5/17/2015,2015,5,17,12:23:41 AM,0,23,39.4317171,-121.7259367,Vegetation,Rural,< 0.25 Acres,Self Extinguished,,100414389,Pacific Bell,12000,Conductor,Overhead,Yes,5/17/2015 23:41,5/17/2015 23:41,Equipment/ Facility Failure,Conductor,N.A.,N.A.,Unknown,,,,2015-05-17 00:23:00,,11.2
321,67,5/19/2015,2015,5,19,12:13:31 AM,0,13,37.92734,-122.08633,Vegetation,Urban,< 3 meters ,Fire Agency,CONTRA COSTA   FIRE,100476269,Pacific Bell,21000,Switch,Overhead,Yes,5/19/2015 13:31,5/19/2015 13:31,Equipment/ Facility Failure,Switch,N.A.,N.A.,Unknown,,,,2015-05-19 00:13:00,no data,11.2
322,68,5/21/2015,2015,5,21,12:06:02 AM,0,6,36.21518,-121.16458600000001,Vegetation,Rural,< 0.25 Acres,Fire Agency,CAL FIRE,3 pole structure east side 101 south of central,,0 – 750,Unknown,Overhead,No, , ,Unknown,N.A.,N.A.,N.A.,Unknown,,,,2015-05-21 00:06:00,no data,11.2
323,69,5/21/2015,2015,5,21,12:09:23 AM,0,9,38.59964,-122.99354,Vegetation,Rural,< 0.25 Acres,Fire Agency,CAL FIRE,4 SPANS LOAD SIDE 2993,,12000,Conductor,Overhead,Yes,5/21/2015 9:23,5/21/2015 9:23,Contact From Object,N.A.,Vegetation,Electric Facility,Unknown,,,,2015-05-21 00:09:00,14.8,18.4
324,70,5/24/2015,2015,5,24,12:10:59 AM,0,10,36.2012983,-121.16115829999998,Vegetation,Rural,.26 - 9.99 Acres,Fire Agency,king city fire department,101734774,Pacific Bell,12000,Conductor,Overhead,Yes,5/24/2015 10:59,5/24/2015 10:59,Contact From Object,N.A.,Animal,Electric Facility,Unknown,,,,2015-05-24 00:10:00,no data,18.4
325,71,5/25/2015,2015,5,25,12:02:42 AM,0,2,38.702693,-121.900084,Vegetation,Rural,.26 - 9.99 Acres,Unknown,,Str. 029/177,,115000,Unknown,Overhead,Yes,5/25/2015 2:42,5/25/2015 2:42,Unknown,N.A.,N.A.,N.A.,Unknown,,,,2015-05-25 00:02:00,24.1,27.7
326,72,5/26/2015,2015,5,26,12:05:44 AM,0,5,36.1660967,-120.25348329999998,Vegetation,Rural,< 0.25 Acres,Fire Agency,FRESNO COUNTY FIRE DEPT.,OFF PHELPS 2 MILES E/O CALAVERAS,,0 – 750,Conductor,Overhead,No, , ,Other,N.A.,N.A.,N.A.,Other,Crow's nest caught fire,,,2015-05-26 00:05:00,9.4,13.0
327,73,5/27/2015,2015,5,27,12:01:02 AM,0,1,36.598642,-119.42185,Vegetation,Rural,.26 - 9.99 Acres,Fire Agency,Reedley Fire /dept,"Open field by Riser 7465, Zumwalt Ave S/O Manning Ave, Reedley",Verizon,12000,Conductor,Overhead,Yes,5/27/2015 1:02,5/27/2015 1:02,Equipment/ Facility Failure,Conductor,N.A.,N.A.,Unknown,UG cable,,,2015-05-27 00:01:00,16.6,16.6
328,74,5/27/2015,2015,5,27,12:21:44 AM,0,21,39.16901,-120.9612,Vegetation,Rural,< 0.25 Acres,Fire Agency,PEARDALE F.D.,100077687,,12000,Conductor,Overhead,Yes,5/27/2015 21:44,5/27/2015 21:44,Contact From Object,N.A.,Vegetation,Electric Facility,Unknown,,,,2015-05-27 00:21:00,0.0,11.2
329,75,5/28/2015,2015,5,28,12:17:09 AM,0,17,40.3942101,-122.28906210000001,Vegetation,Urban,< 0.25 Acres,Unknown,,101492440,Pacific Bell,0 – 750,Transformer,Overhead,Yes,5/28/2015 17:09,5/28/2015 17:09,Equipment/ Facility Failure,Transformer,N.A.,N.A.,Unknown,,,,2015-05-28 00:17:00,24.1,24.1
330,76,5/29/2015,2015,5,29,12:11:31 AM,0,11,36.963983,-121.533482,Vegetation,Rural,< 0.25 Acres,Fire Agency,CAL FIRE,100616133,,21000,Conductor,Overhead,Yes,5/29/2015 11:31,5/29/2015 11:31,Contact From Object,N.A.,Vehicle,Pole,Human Error,,,,2015-05-29 00:11:00,24.1,27.7
331,77,5/30/2015,2015,5,30,12:09:06 AM,0,9,39.474257,-121.698095,Vegetation,Rural,< 0.25 Acres,Unknown,,,,12000,Conductor,Overhead,Yes,5/30/2015 9:06,5/30/2015 9:06,Contact From Object,N.A.,Other,Electric Facility,Human Error,helicopter hit line,,,2015-05-30 00:09:00,no data,27.7
332,78,5/30/2015,2015,5,30,12:11:04 AM,0,11,36.90227,-119.7737,Vegetation,Rural,.26 - 9.99 Acres,Self Extinguished,,100643725,,12000,Conductor,Overhead,Yes,5/30/2015 11:04,5/30/2015 11:04,Contact From Object,N.A.,Vehicle,Pole,Human Error,,,,2015-05-30 00:11:00,9.4,13.0
333,79,5/30/2015,2015,5,30,12:12:52 AM,0,12,38.7371312,-120.8122124,Vegetation,Urban,< 3 meters ,Fire Agency,el dorado co fire district,across from 2669 hwy 49,,12000,Fuse,Overhead,Yes,5/30/2015 12:52,5/30/2015 12:52,Equipment/ Facility Failure,Fuse,N.A.,N.A.,Unknown,,,,2015-05-30 00:12:00,7.6,11.2
334,80,5/30/2015,2015,5,30,12:17:35 AM,0,17,38.725373,-120.832572,Vegetation,Rural,< 3 meters ,Fire Agency,el dorado co fire,"100 placerville dr behind maint shop, Placerville",,12000,Conductor,Overhead,Yes,5/30/2015 17:35,5/30/2015 17:35,Contact From Object,N.A.,Animal,Electric Facility,Unknown,,,,2015-05-30 00:17:00,7.6,11.2
335,81,5/31/2015,2015,5,31,12:00:23 AM,0,0,37.29657999,-120.468249,Vegetation,Urban,< 3 meters ,Fire Agency,HAD LEFT SCENE BEFORE ARRIVAL,101157239,Pacific Bell,0 – 750,Conductor,Overhead,No, , ,Equipment/ Facility Failure,Splice/Clamp/Connector,N.A.,N.A.,Unknown,,,,2015-05-31 00:00:00,11.2,11.2
336,82,5/31/2015,2015,5,31,12:07:07 AM,0,7,38.782371000000005,-121.480176,Vegetation,Rural,.26 - 9.99 Acres,Fire Agency,Pleasnt Grove Fire Dept  Station #,"3700 Sankey Rd, Pleasant Grove",,12000,Unknown,Overhead,Yes,5/31/2015 7:07,5/31/2015 7:07,Unknown,N.A.,N.A.,N.A.,Unknown,,,,2015-05-31 00:07:00,14.8,14.8
337,83,5/31/2015,2015,5,31,12:09:27 AM,0,9,37.97744999,-121.32671,Vegetation,Urban,< 0.25 Acres,Customer,,102057703,Pacific Bell,12000,Conductor,Overhead,No, , ,Contact From Object,N.A.,Balloons,Electric Facility,Human Error,,,,2015-05-31 00:09:00,14.8,18.4
338,84,5/31/2015,2015,5,31,12:11:31 AM,0,11,37.273249,-120.470983,Vegetation,Rural,< 0.25 Acres,Fire Agency,CAL FIRE,101152842,Pacific Bell,0 – 750,Conductor,Overhead,No, , ,Contact From Object,N.A.,Vegetation,Electric Facility,Human Error,Third-party caused,,,2015-05-31 00:11:00,11.2,11.2
339,85,5/31/2015,2015,5,31,12:11:55 AM,0,11,37.72184999,-120.79310900000002,Vegetation,Rural,< 3 meters ,Customer,NONE,102340604,None,0 – 750,Conductor,Overhead,No, , ,Equipment/ Facility Failure,Splice/Clamp/Connector,N.A.,N.A.,Unknown,,,,2015-05-31 00:11:00,13.0,13.0
340,86,6/3/2015,2015,6,3,12:09:33 AM,0,9,39.68957,-121.62161200000001,Vegetation,Rural,< 0.25 Acres,Fire Agency,CAL FIRE,,,12000,Conductor,Overhead,Yes,6/3/2015 9:33,6/3/2015 9:33,Contact From Object,N.A.,Vegetation,Electric Facility,Unknown,,,,2015-06-03 00:09:00,36.0,36.0
341,87,6/3/2015,2015,6,3,12:13:44 AM,0,13,38.62700999,-121.07658899999998,Vegetation,Rural,< 0.25 Acres,Fire Agency,CAL FIRE,103035299,,21000,Conductor,Overhead,Yes,6/3/2015 13:44,6/3/2015 13:44,Contact From Object,N.A.,Vehicle,Pole,Human Error,,,,2015-06-03 00:13:00,9.4,11.2
342,88,6/3/2015,2015,6,3,12:17:09 AM,0,17,35.36122999,-119.00621899999999,Vegetation,Urban,< 0.25 Acres,Fire Agency,KCFD AND BCFD,100150055,Pacific Bell,0 – 750,Conductor,Overhead,No, , ,Equipment/ Facility Failure,Splice/Clamp/Connector,N.A.,N.A.,Unknown,,,,2015-06-03 00:17:00,22.3,22.3
343,89,6/4/2015,2015,6,4,12:13:17 AM,0,13,39.269385,-123.784108,Vegetation,Rural,< 0.25 Acres,Fire Agency,CAL FIRE,,,12000,Conductor,Overhead,Yes,6/4/2015 13:17,6/4/2015 13:17,Contact From Object,N.A.,Vehicle,Pole,Human Error,,,,2015-06-04 00:13:00,16.6,22.3
344,90,6/4/2015,2015,6,4,12:15:44 AM,0,15,39.46837,-121.561279,Vegetation,Rural,.26 - 9.99 Acres,Fire Agency,CAL FIRE,powerhouse hill rd 2spans e on ophir rd,,12000,Conductor,Overhead,Yes,6/4/2015 15:44,6/4/2015 15:44,Contact From Object,N.A.,Vehicle,Pole,Human Error,,,,2015-06-04 00:15:00,16.6,16.6
345,91,6/4/2015,2015,6,4,12:16:38 AM,0,16,38.58800999,-121.51708899999998,Vegetation,Urban,< 3 meters ,Fire Agency,west sacramento FD,101565849,Pacific Bell,12000,Unknown,Overhead,Yes,6/4/2015 16:38,6/4/2015 16:38,Unknown,N.A.,N.A.,N.A.,Unknown,,,,2015-06-04 00:16:00,16.6,20.5
346,92,6/4/2015,2015,6,4,12:20:00 AM,0,20,38.6916,-120.860579,Vegetation,Rural,< 0.25 Acres,Fire Agency,CAL FIRE,101412760,Pacific Bell,12000,Conductor,Overhead,Yes,6/4/2015 20:00,6/4/2015 20:00,Contact From Object,N.A.,Vegetation,Electric Facility,Human Error,Third-party caused,,,2015-06-04 00:20:00,11.2,14.8
347,93,6/5/2015,2015,6,5,12:01:25 AM,0,1,38.3460656,-122.39978980000001,Vegetation,Rural,< 0.25 Acres,Fire Agency,,4870 REDWOOD,,21000,Conductor,Overhead,Yes,6/5/2015 1:25,6/5/2015 1:25,Contact From Object,N.A.,Vegetation,Electric Facility,Unknown,,,,2015-06-05 00:01:00,24.1,29.5
348,94,6/5/2015,2015,6,5,12:09:58 AM,0,9,40.107034000000006,-123.714223,Vegetation,Rural,.26 - 9.99 Acres,Fire Agency,CAL FIRE,100986799,,12000,Conductor,Overhead,Yes,6/5/2015 9:58,6/5/2015 9:58,Equipment/ Facility Failure,Other,N.A.,N.A.,Unknown,tie wire,,,2015-06-05 00:09:00,24.1,29.5
349,95,6/5/2015,2015,6,5,12:14:40 AM,0,14,37.95776999,-120.45190900000001,Vegetation,Rural,< 0.25 Acres,Fire Agency,CAL FIRE,101012484,,17000,Conductor,Overhead,Yes,6/5/2015 14:40,6/5/2015 14:40,Equipment/ Facility Failure,Splice/Clamp/Connector,N.A.,N.A.,Unknown,,,,2015-06-05 00:14:00,11.2,13.0
350,96,6/5/2015,2015,6,5,12:15:15 AM,0,15,36.77590999,-119.770269,Vegetation,Urban,< 0.25 Acres,Fire Agency,CITY OF FRESNO,100857009,Pacific Bell,0 – 750,Transformer,Overhead,Yes,6/5/2015 15:15,6/5/2015 15:15,Equipment/ Facility Failure,Transformer,N.A.,N.A.,Unknown,,,,2015-06-05 00:15:00,14.8,16.6
351,97,6/5/2015,2015,6,5,12:22:13 AM,0,22,38.7729,-121.46992,Vegetation,Rural,< 3 meters ,Fire Agency,WATER,100064053,,12000,Capacitor Bank,Overhead,Yes,6/5/2015 22:13,6/5/2015 22:13,Equipment/ Facility Failure,Capacitor Bank,N.A.,N.A.,Unknown,,,,2015-06-05 00:22:00,0.0,13.0
352,98,6/6/2015,2015,6,6,12:11:24 AM,0,11,39.802946,-121.90643,Vegetation,Rural,< 3 meters ,Unknown,,100433862,Pacific Bell,12000,Conductor,Overhead,Yes,6/6/2015 11:24,6/6/2015 11:24,Equipment/ Facility Failure,Splice/Clamp/Connector,N.A.,N.A.,Unknown,,,,2015-06-06 00:11:00,54.0,54.0
353,99,6/6/2015,2015,6,6,12:12:00 AM,0,12,36.9828151,-120.0332412,Vegetation,Rural,< 0.25 Acres,Unknown,,101015092,,12000,Lightning Arrestor,Overhead,Yes,6/6/2015 12:00,6/6/2015 12:00,Equipment/ Facility Failure,Lightning Arrestor,N.A.,N.A.,Unknown,,,,2015-06-06 00:12:00,9.4,9.4
354,100,6/6/2015,2015,6,6,12:15:38 AM,0,15,39.04088999,-123.40188899999998,Vegetation,Rural,< 0.25 Acres,Fire Agency,CAL FIRE,11480 ANDERSON VALLEY WAY @ BRIDGE,,12000,Conductor,Overhead,Yes,6/6/2015 15:38,6/6/2015 15:38,Contact From Object,N.A.,Vegetation,Electric Facility,Unknown,,,,2015-06-06 00:15:00,16.6,20.5
355,101,6/6/2015,2015,6,6,12:21:17 AM,0,21,38.00574999,-121.238219,Vegetation,Rural,< 0.25 Acres,Fire Agency,COUNTY FIRE,102135759,Pacific Bell,12000,Conductor,Overhead,Yes,6/6/2015 21:17,6/6/2015 21:17,Contact From Object,N.A.,Balloons,Electric Facility,Human Error,,,,2015-06-06 00:21:00,7.6,16.6
356,102,6/7/2015,2015,6,7,12:05:05 AM,0,5,36.6906,-119.7488,Vegetation,Rural,.26 - 9.99 Acres,Fire Agency,FRESNO FIRE,103339346,,12000,Conductor,Overhead,Yes,6/7/2015 5:05,6/7/2015 5:05,Equipment/ Facility Failure,Other,N.A.,N.A.,Unknown,,,,2015-06-07 00:05:00,0.0,11.2
357,103,6/7/2015,2015,6,7,12:14:53 AM,0,14,36.3216,-121.28363,Vegetation,Rural,< 0.25 Acres,Fire Agency,monterey county,peach and thorne greenfield,Pacific Bell,12000,Unknown,Overhead,Yes,6/7/2015 14:53,6/7/2015 14:53,Unknown,N.A.,N.A.,N.A.,Unknown,,,,2015-06-07 00:14:00,no data,11.2
358,104,6/7/2015,2015,6,7,12:17:48 AM,0,17,38.217944,-121.97523600000001,Vegetation,Rural,100 - 299 Acres,Fire Agency,Suisun fire protection district.,c/o's 278361,,21000,Conductor,Overhead,Yes,6/7/2015 17:48,6/7/2015 17:48,Vandalism/Theft,N.A.,N.A.,N.A.,Human Error,gun-shot conductor,,,2015-06-07 00:17:00,40.7,46.4
359,105,6/8/2015,2015,6,8,12:14:18 AM,0,14,38.179556,-120.958991,Vegetation,Rural,10 - 99 Acres,Fire Agency,CAL FIRE,102048579,Pacific Bell,12000,Conductor,Overhead,Yes,6/8/2015 14:18,6/8/2015 14:18,Contact From Object,N.A.,Vehicle,Pole,Human Error,,,,2015-06-08 00:14:00,no data,46.4
360,106,6/8/2015,2015,6,8,12:16:12 AM,0,16,38.11553999,-122.556219,Vegetation,Rural,< 3 meters ,Fire Agency,novato fire,front yard 9 equestrian ct,,0 – 750,Conductor,Overhead,No, , ,Contact From Object,N.A.,Vegetation,Electric Facility,Unknown,,,,2015-06-08 00:16:00,24.1,27.7
361,107,6/8/2015,2015,6,8,12:16:15 AM,0,16,39.82356,-123.60931000000001,Vegetation,Rural,.26 - 9.99 Acres,Fire Agency,CAL FIRE,2 spans loadside 1741,,12000,Conductor,Overhead,Yes,6/8/2015 16:15,6/8/2015 16:15,Contact From Object,N.A.,Vegetation,Electric Facility,Unknown,,,,2015-06-08 00:16:00,11.2,18.4
362,108,6/8/2015,2015,6,8,12:17:38 AM,0,17,37.9582,-121.94405900000001,Vegetation,Urban,< 3 meters ,Unknown,,T7325       ,,0 – 750,Conductor,Overhead,Yes,6/8/2015 17:38,6/8/2015 17:38,Equipment/ Facility Failure,Conductor,N.A.,N.A.,Unknown,,,,2015-06-08 00:17:00,22.3,24.1
363,109,6/8/2015,2015,6,8,12:18:32 AM,0,18,37.9404,-122.079489,Vegetation,Urban,< 3 meters ,Fire Agency,CONTRA COSTA   FIRE,100462348,Pacific Bell,0 – 750,Fuse,Overhead,Yes,6/8/2015 18:32,6/8/2015 18:32,Equipment/ Facility Failure,Fuse,N.A.,N.A.,Unknown,,,,2015-06-08 00:18:00,no data,24.1
